en_text,file_names
 Diseases transmitted from animals to humans are collectively known as zoonotic diseases.,common_voice_en_38220385.mp3
 The old word horse is a cognate of the English word horse.,common_voice_en_38033386.mp3
 It is owned by the Jockey Club.,common_voice_en_38430246.mp3
 It originates in the Northern Range and brings into the Koraville,common_voice_en_38099434.mp3
 On the fiftieth of the twelfth moon he gathered corn cobs.,common_voice_en_38312727.mp3
 Thank you.,common_voice_en_38415376.mp3
" Thus, a monk needs to choose a tradition only upon reaching that level.",common_voice_en_38325763.mp3
 His daughter Michelle came painting instead and was elected as matrimonial.,common_voice_en_38159563.mp3
 The Liberals had the undisguised support of England.,common_voice_en_38235360.mp3
 The souls of the dead would not allow it to sprout.,common_voice_en_38267151.mp3
 The father of Hashi Lokman Billin was later prosecuted for attending his son's funeral.,common_voice_en_38111669.mp3
 Additional single scenarios may be created using the map editor included.,common_voice_en_38030498.mp3
 Micromart had several quilts that helped give it an identity.,common_voice_en_38027331.mp3
 The imaginative side of Rose's nature expressed itself early on in The Natal Witness.,common_voice_en_38162309.mp3
" The virus had not voluntarily given their children away, she said.",common_voice_en_38349525.mp3
" W tym odcinku, znowu strzelanie konwoju heroów.",common_voice_en_38352845.mp3
 Laurence Ferlinghetti called him the Thoreau of the Beat Generation.,common_voice_en_38390330.mp3
 It is the only Southwest Florida-based station carried on Comcast's range system.,common_voice_en_38124826.mp3
" Subsequently, the characters start to age in real time and undergo significant life changes.",common_voice_en_38377025.mp3
 The lake is used for the city of Rochester's water supply.,common_voice_en_38240689.mp3
" A year later, King Ward bought the same vacation rights to another Griffin show, Joe Pardee.",common_voice_en_38033634.mp3
 The invention of an accurate marine chronometer revolutionized marine navigation.,common_voice_en_38390279.mp3
" In the Domesday Book, Lambeth is called Lanchay, likely in error.",common_voice_en_38359721.mp3
 He has the right of asking a favor from the Sultan.,common_voice_en_38300132.mp3
 The customs and styles are heavily influenced by the tradition of the Spanish universities.,common_voice_en_38156047.mp3
 It is now written with Latin letters.,common_voice_en_38343430.mp3
 Sam said that the item was too vulgar and would never sell.,common_voice_en_38250662.mp3
 Who is you? What kind of you?,common_voice_en_38390085.mp3
" West Drayton also incorporates a conservation area, the Green.",common_voice_en_38220381.mp3
" The Yellow Brigade also bring drums, trumpet and flags to every match.",common_voice_en_38352713.mp3
 Plant Dump Pond Park Features Walking Paths and Steering Areas,common_voice_en_38332781.mp3
" They have a daughter, Eleanor Jasmine.",common_voice_en_38384967.mp3
 The West Perry Civic Club is the area civic club,common_voice_en_38111872.mp3
" Along with modeling and television, Rivero also worked in the music industry.",common_voice_en_38166025.mp3
 The other synagogues were destroyed when Genova was attacked by Nazi Germany.,common_voice_en_38406247.mp3
" Only Patty Harrison, Dylan and Lane took part in recording the song.",common_voice_en_38126162.mp3
" Kwa hivyo, kwa hivyo, kwa hivyo, kwa hivyo, kwa hivyo, kwa hivyo, kwa hivyo, kwa hivyo, kwa hivyo, kwa hivyo, kwa hivyo, kwa hivyo, kwa hivyo, kwa hivyo, kwa hivyo, kwa hivyo, kwa hivyo, kwa hivyo, kwa hivyo, kwa hivyo, kwa hivyo",common_voice_en_38122261.mp3
 Several original problems included puppets who kill comedy now.,common_voice_en_38138198.mp3
 Alpine swifts breed in mountains from southern Europe to the Himalaya.,common_voice_en_38398590.mp3
" Blackout spawned two singles, No One Like You and Can't Live Without You.",common_voice_en_38054292.mp3
 Both groups belong to the Dhaka First Nations.,common_voice_en_38129686.mp3
 Niles and illustrator Ben Temple Smith produced the first issue for free.,common_voice_en_38108847.mp3
 DAD!,common_voice_en_38390122.mp3
 Foster later advised the Warwickshire Committee to drop him.,common_voice_en_38395329.mp3
 Frozen waffles do not require a waffle iron to prepare.,common_voice_en_38132926.mp3
 This is the 16th chapter.,common_voice_en_38420653.mp3
" Though not fortified, Bastides were often built in defensible locations.",common_voice_en_38352716.mp3
 The wisdom box typically has a much higher alcohol content than the lighter doses.,common_voice_en_38249069.mp3
 They described their sound as high energy rock and roll street noise.,common_voice_en_38155826.mp3
 The inhabitants are called Shilikois in French and Shelijema in Alsatian.,common_voice_en_38083294.mp3
 Fred played basketball and baseball at Louisiana State University in the dozen Louisiana University.,common_voice_en_38169260.mp3
 He was also a member of several folklore societies.,common_voice_en_38352448.mp3
 Let's crack the hole with a paper cut sheet of 2cm.,common_voice_en_38349509.mp3
" Academic skeptics accept probabilism, while Peronian skeptics do not.",common_voice_en_38089974.mp3
" Tully was born in Tully Grange, British India.",common_voice_en_38035532.mp3
" Kwa hivyo, kwa kwa, kwa kwa, kwa kwa, kwa kwa, kwa kwa, kwa kwa, kwa kwa, kwa kwa, kwa kwa, kwa kwa, kwa kwa, kwa kwa, kwa kwa, kwa kwa, kwa kwa, kwa kwa, kwa kwa, kwa kwa, kwa kwa, kwa kwa, kwa kwa, kwa kwa, kwa kwa, kwa kwa",common_voice_en_38111902.mp3
 Еуән тұсқыл үнің қалп бұрын жәнден Түркесіз Саз Қоледж Оқслан.,common_voice_en_38313968.mp3
 It is part of the Greater Monterey metropolitan area.,common_voice_en_38029136.mp3
" Died in Vienna, his grave is in St. Maxime.",common_voice_en_38361848.mp3
 Thank you.,common_voice_en_38448262.mp3
 When is the time who comes?,common_voice_en_38274930.mp3
 The chief acted as high priest and prayed aloud as follows.,common_voice_en_38265168.mp3
 The village gives its name to the discourse of the prophet.,common_voice_en_38091864.mp3
 This event proves to be of utmost importance to the subsequent path he chose.,common_voice_en_38099431.mp3
 No one in the village may use any sharp or pointed instrument.,common_voice_en_38308168.mp3
 He is peerless in the use of his worth through the maze.,common_voice_en_38339214.mp3
 It has become a major bedroom community for Dahi.,common_voice_en_38028823.mp3
 His wife is said to have been the first white woman in the area.,common_voice_en_38347092.mp3
 The same effect is produced by similar means in the case of victorious warriors.,common_voice_en_38318418.mp3
 He also began writing the true Kali pieces in his bedtime.,common_voice_en_38316579.mp3
 The following names are traditional addresses of Mark Greco with little documented evidence.,common_voice_en_38154696.mp3
 A Latvian-Soviet peace treaty then formally ended Latvia's war for independence.,common_voice_en_38357848.mp3
 The travelers board the ship of Solomon intent to complete the mystical Grail quest.,common_voice_en_38377227.mp3
 Stark was arrested multiple times by the terrorist authorities and was exiled.,common_voice_en_38341378.mp3
" Diamond's brother Eddie was Oregon's bodyguard, but Legg's diamond substituted for Eddie that day.",common_voice_en_38146095.mp3
 The chipset are listed in chronological order.,common_voice_en_38392320.mp3
 He studied social science at Rockland University College and has a minor in history.,common_voice_en_38328865.mp3
 The Crimson Tide for last place in the AV League.,common_voice_en_38030670.mp3
 Schüller had just one interception that year.,common_voice_en_38114661.mp3
" Harris may be garnished with cinnamon, sugar and clarified butter.",common_voice_en_38070320.mp3
 The organization publishes a bi-monthly magazine distributed to members called the Canadian Amateur.,common_voice_en_38035491.mp3
 Thank you.,common_voice_en_38449192.mp3
 Thank you.,common_voice_en_38403338.mp3
 The degree program results in an Associate of Applied Science degree in Environmental.,common_voice_en_38126200.mp3
" Yom Nis Yashayom, the father of the victims, said in Seruano, I'm tired.",common_voice_en_38050422.mp3
 His father worked for brewing multinational Guinness Place and became Malaysian marketing director.,common_voice_en_38376925.mp3
" Their goal was not to back Peaks, but simply to find the thrush.",common_voice_en_38178153.mp3
 It serves the suburb of Bepangare in the Mauritan Bay region.,common_voice_en_38358819.mp3
 Estonian participation at the Venice Biennale is supported by the Ministry of Culture.,common_voice_en_38156655.mp3
" It will save you a lot of use of time, so it's the best to sell on the list.",common_voice_en_38354211.mp3
 European-American pioneers improved and expanded the older route.,common_voice_en_38217538.mp3
 He spent six months on drug rehabilitation before returning to Germany.,common_voice_en_38029457.mp3
" The steel code held the arena center court scoreboard, sound and lighting systems.",common_voice_en_38038774.mp3
 The territory is to be contiguous and compact without oddly shaped boundaries.,common_voice_en_38059588.mp3
 The effect of the conjecture charges zone on local businesses is a contested issue.,common_voice_en_38347124.mp3
 The warriors flocked together from the outlying districts under their respective captains.,common_voice_en_38308155.mp3
 Guerrero later wrote that in the storyline he was Dominique's political father.,common_voice_en_38398624.mp3
 The SPI features single-point fuel injection rather than the multi-point of the later engine.,common_voice_en_38027279.mp3
 Thank you.,common_voice_en_38424544.mp3
 The bridegroom is the presiding deity of the local temple.,common_voice_en_38283991.mp3
 I want to eat and I want some cake.,common_voice_en_38471795.mp3
 The town is served by the Round Top Carmine Independent School District.,common_voice_en_38365578.mp3
 FlyingFall has had a number of their writers and designers with this award.,common_voice_en_38249082.mp3
" This creek is located in the forest alone, Hollywood Hills, the nation.",common_voice_en_38316419.mp3
 Ritofma,common_voice_en_38352667.mp3
 Beerman had chosen the gold color because the football blended in with the uniforms.,common_voice_en_38064140.mp3
" He left a sign, Michael Webb.",common_voice_en_38025245.mp3
 This technique overcomes the problems with open or short circuit taps.,common_voice_en_38192951.mp3
 The angry spirits of the departed are the cause of all the suffering.,common_voice_en_38213358.mp3
 They safeguard ancient knowledge and rights through a vast oral tradition.,common_voice_en_38291614.mp3
 The substantial identity of the Demeter and the Pestron has been recognized by some modern scholars.,common_voice_en_38286778.mp3
 They give it a broom in one hand and a scythe in the other.,common_voice_en_38308169.mp3
 The new manager was a resident of Nashville and familiar with the area.,common_voice_en_38249108.mp3
" Its headquarters is located in Silver Spring, Maryland.",common_voice_en_38164351.mp3
 So Lancaster was named after Lancaster. Lancaster Shire and Lancastrian is an inhabitant of Lancashire.,common_voice_en_38033540.mp3
 It was constructed in ashlar stone and was castellated.,common_voice_en_38040547.mp3
 The old type of Osiris was better preserved than those of Adonis and Attis.,common_voice_en_38267353.mp3
 The Otawa senators objected to aiding of the team but were outvoted.,common_voice_en_38377024.mp3
" At Luloth Cove there is a fossil forest of conifers, tree ferns and cycads.",common_voice_en_38129644.mp3
 She introduced students to John Baez and Kwon Taelyn in poetry class.,common_voice_en_38079116.mp3
 The name derives from a meeting house on the square called the Gald Hall.,common_voice_en_38030660.mp3
 His music teacher was the Kwaito composer and volvianolist Alfonso Arroz.,common_voice_en_38352471.mp3
 He has decided that smashing pumpkins is his favorite band.,common_voice_en_38025127.mp3
" That was pretty unusual in Karada, because all was the worry of our HD rate.",common_voice_en_38349134.mp3
" Examples include the mystic hermaphrodite, the hunter, and the demagogue.",common_voice_en_38212736.mp3
 Wayne College was originally called Arkansas College.,common_voice_en_38057764.mp3
 They make loud noises for the purpose of satisfying her grandmotherly solicitude.,common_voice_en_38318420.mp3
 Thank you.,common_voice_en_38438964.mp3
 One evening I spied my victim at his club.,common_voice_en_38280127.mp3
 Thank you.,common_voice_en_38448312.mp3
 Thank you.,common_voice_en_38450997.mp3
 Perhaps the most instructive of these mimic executions is the following bohemian one.,common_voice_en_38315448.mp3
 This was followed 10 years later by Arkea Israel Airlines flights.,common_voice_en_38249280.mp3
 Instructions are given for the building of three subterranean granaries.,common_voice_en_38265140.mp3
 Kjell Kronström,common_voice_en_38414901.mp3
 He played college football for Auburn University.,common_voice_en_38052624.mp3
" Revenge of the Zodiac berlalu 9 bab, walaupun yang pertama hanya berkisar tentang diri.",common_voice_en_38041739.mp3
 The Blue River Airport receives precipitation per year.,common_voice_en_38026367.mp3
 to vNX apps,common_voice_en_38194111.mp3
 The birth manuscript of Genesis Raba is found in the Codex Edge.,common_voice_en_38358438.mp3
" Maxalan was born in Palam, North King's High School and attended Natchezan School.",common_voice_en_38357455.mp3
 Vankech also appeared in films and television.,common_voice_en_38080944.mp3
" Often, community art is based in economically deprived areas with a community-oriented grassroots approach.",common_voice_en_38403920.mp3
 He later was a student at the Nagasaki Naval Training Center.,common_voice_en_38047205.mp3
 For a year they had to sleep on a bed of four oars.,common_voice_en_38311612.mp3
" Kona Ten was born in Mount Bilu, country called",common_voice_en_38079067.mp3
 The dam is broken down and the stream pours into the ditch.,common_voice_en_38328118.mp3
 Linguistic Anthropology studies how language affects social life.,common_voice_en_38081497.mp3
 War Caster was subsequently tethered at San Francisco and,common_voice_en_38037325.mp3
 To other people he is known only under an assumed name.,common_voice_en_38284581.mp3
 South Australia was made responsible for the administration of the Northern Territory.,common_voice_en_38334041.mp3
 Incense was burnt at the corresponding Babylonian rites.,common_voice_en_38300093.mp3
" It was sponsored by the Methodist Church, but was a non-sectarian institution.",common_voice_en_38251622.mp3
" Mainly, Buddhism has influenced in molding the cultural heritage of the country.",common_voice_en_38029526.mp3
 ത്ത്ത്ത്ത്ത്ത്ത്ത്ത്ത്ത്ത്ത്ത്ത്ത്ത്ത്ത്ത്ത്ത്ത്ത�,common_voice_en_38083444.mp3
 They are converted for use in gardens and have been introduced to North America.,common_voice_en_38138173.mp3
 തതതതതതതതതതതതതതതതതതതതതതതതതതതതതതതതതതതതതതതതതതതതതതതതതതതതതതതതതതതതതത,common_voice_en_38081643.mp3
 Thank you.,common_voice_en_38448138.mp3
" After two years in Mexico City, I moved to Brooklyn, New York.",common_voice_en_38470868.mp3
 Rice Video performs differently depending on the graphics it is processing.,common_voice_en_38173990.mp3
 Thank you for your patience and interest. Stay tuned.,common_voice_en_38394619.mp3
 The town is the headquarters of Squamish Indian tribe.,common_voice_en_38078973.mp3
 Its distribution is invariant under orthogonal conjugation and it models Hamiltonians with time-reversal symmetry.,common_voice_en_38164368.mp3
 The barley had sprouted and sent out shoots two or three inches long.,common_voice_en_38328915.mp3
 Thank you.,common_voice_en_38424784.mp3
 Thank you.,common_voice_en_38420938.mp3
 The work features views to Kapiti Island.,common_voice_en_38100188.mp3
 An image of Dionysius is said to have been found in a planetary.,common_voice_en_38284540.mp3
 The name belongs to several religions which has known a saint serial.,common_voice_en_38080941.mp3
 The unincorporated community of Kelly is located in the town.,common_voice_en_38371257.mp3
" Lexically, it shares a lot of vocabulary with Portuguese.",common_voice_en_38033608.mp3
 Swede was invited to talk to Rolling Stone without internet fame.,common_voice_en_38116516.mp3
 Hades is fabled to have carried of Demeter's daughter.,common_voice_en_38304357.mp3
 It is in South Mannheim and Wayne townships.,common_voice_en_38251791.mp3
 He is addressed as a king and escorted with music.,common_voice_en_38287705.mp3
 Mikhailov is bringing home the threat that Trump poses to society.,common_voice_en_38389711.mp3
 Завтра я буду с ним ураганить.,common_voice_en_38417206.mp3
 I'm almost there.,common_voice_en_38274897.mp3
 The modern type of kingship has diverged from the ancient pattern.,common_voice_en_38318804.mp3
 The office are in one or two royal families.,common_voice_en_38398180.mp3
 Functions of this type were originally investigated by Peter Gustav Leuzen Dierichov.,common_voice_en_38220551.mp3
 Teksting av Nicolai Winther,common_voice_en_38421005.mp3
" It also has a presence in the clean room, safety and clinical markets.",common_voice_en_38398181.mp3
 A single version of regeneration preceded the physical album.,common_voice_en_38377184.mp3
 Kedua-dua dari mereka menjadi kapten Amerika dan paket baru yang dihormati.,common_voice_en_38348954.mp3
 They were subsequently modified and released back into revenue in series.,common_voice_en_38394754.mp3
" Henry's mother was Blanche of Artois, Queen Dowager of Navarre.",common_voice_en_38070719.mp3
 Man and one woman from the losing team.,common_voice_en_38419824.mp3
 The production of Vertigo differed from the first prototype in materials and design.,common_voice_en_38251586.mp3
 The Kineze Osaka Line has a major role in transportation in Oda.,common_voice_en_38403064.mp3
 On va se battre pour le père au lointain.,common_voice_en_38356374.mp3
 They stand out sharply against the green background of the forest.,common_voice_en_38444663.mp3
 You have done a day book sticking,common_voice_en_38166231.mp3
 Thank you.,common_voice_en_38177885.mp3
" Using the flight intercom, Han Zhou announced that the flight was hijacked.",common_voice_en_38341795.mp3
 This might have been attended with dangerous results to the Hasmonean dynasty.,common_voice_en_38337616.mp3
 Go!,common_voice_en_38419406.mp3
 It is an ester composed of butyric acid and glycerol.,common_voice_en_38403887.mp3
 In Polish it denotes a home brew vodka or vodka used for its preparation.,common_voice_en_38403304.mp3
 The award therefore applies retroactively.,common_voice_en_38154533.mp3
 Dan Nimizen adalah bagian dari Akademi Toulouse.,common_voice_en_38336127.mp3
 Seabird began her career working on Fay's brokerages.,common_voice_en_38122507.mp3
 The aircraft was written off and subsequently scrapped.,common_voice_en_38029269.mp3
 Bed load is complimentary to suspended load and wash load.,common_voice_en_38034566.mp3
" The club owns three aircraft, two ultralight Husky Northmen and one PL Super Emerald",common_voice_en_38369227.mp3
 Doug knew Paul and Annie liked one another and he liked them.,common_voice_en_38037321.mp3
 Her research involved the use of neuroimaging methods to understand aging and memory.,common_voice_en_38390268.mp3
 Numbers in parentheses indicate the number of athletes representing each nation.,common_voice_en_38100412.mp3
 sahab was at originally wanted the holst royce midway as the beacon's power-plane,common_voice_en_38164751.mp3
" However, it has been suggested that the term originated earlier than this in Yorkshire.",common_voice_en_38384965.mp3
 Who's brought a child out to do the same school?,common_voice_en_38356363.mp3
" Williamstown Railway Line is a shuttle service which is entirely located in Hobson, Spain.",common_voice_en_38089540.mp3
 A large rocky outcrop just to the east of town is courage and rock.,common_voice_en_38153117.mp3
" During that time, he served as sanhero, or water overseer.",common_voice_en_38032138.mp3
" The colors and symbols of the flag carry cultural, political and regional meanings.",common_voice_en_38041648.mp3
 Thank you.,common_voice_en_38448851.mp3
 All people lived in the camp here to fast strictly.,common_voice_en_38275025.mp3
 Menands is along the Hudson River on the West Bank.,common_voice_en_38383006.mp3
 He was released hours later and took refuge at the Penisivi Committee.,common_voice_en_38376845.mp3
" A street in Mid-Burke, Butler Street, is named for them.",common_voice_en_38025457.mp3
 Morita's apparent individuals post-fed his role in the Karate Kid.,common_voice_en_38358404.mp3
 Poets and musicians were part of an all-embracing body system.,common_voice_en_38376882.mp3
 Here's how Bo is looking along the Inarriba.,common_voice_en_38038402.mp3
 The same architect also designed the velodrome and other facilities.,common_voice_en_38330390.mp3
 He saw the pot as being hypocritical and a great danger to society.,common_voice_en_38332341.mp3
" Parcitectoc-circuited cells have defects in metodic spinal assembly, chromosome segregation and cell division.",common_voice_en_38220544.mp3
 He learns of Porthos' death and Aramis' escape.,common_voice_en_38332785.mp3
 She traveled and painted for several years before discovering photography.,common_voice_en_38080788.mp3
" During the DEMOCRAT HOPE investigation, Vata Sabda, Secretary of the Court, materialed",common_voice_en_38079066.mp3
 He is attended by a boy who dispenses wine to the people.,common_voice_en_38273652.mp3
 That was the quality of the one.,common_voice_en_38420643.mp3
 Their homegrown roaster helped establish what became a top independent promotion in later years.,common_voice_en_38052552.mp3
 they can have the nickname the blade,common_voice_en_38032503.mp3
 6490,common_voice_en_38420642.mp3
 Cleveland was an ill-accompanied one-inch field.,common_voice_en_38335983.mp3
 The castle overlooks a deep gorge going down here.,common_voice_en_38101456.mp3
 You're doing the exact same disposes about.,common_voice_en_38272405.mp3
 Thank you.,common_voice_en_38450548.mp3
" The carving depicts a bird, a lion, on what is possibly a goat.",common_voice_en_38114664.mp3
 Thank you.,common_voice_en_38424541.mp3
 Similar method could have reached the shuttle left wing for inspection or repair.,common_voice_en_38040037.mp3
 He died during the Allied invasion of France in Lyon.,common_voice_en_38077738.mp3
" Worldwide, the single did not equal the success of Williams' previous single, Feel.",common_voice_en_38180612.mp3
" Our predecessor, Sir Alan Langlands, is now the Vice-Chancellor of the University of Leeds.",common_voice_en_38033387.mp3
 A shepherd would rather mention the devil than the wolf.,common_voice_en_38281174.mp3
" Two weeks later, his wife and collaborator Maria died as well.",common_voice_en_38025095.mp3
 Thank you.,common_voice_en_38448470.mp3
 I start from a collection of hymns only fragments of his poetry survive,common_voice_en_38366505.mp3
 The grave of a king is always in the village where he was born.,common_voice_en_38273653.mp3
 The more correct translation is to it to be the principle rise.,common_voice_en_38313951.mp3
 He failed to recognize it as a cycle at all.,common_voice_en_38267340.mp3
 when this ominous weakness manifested itself the wives reported it to the chiefs,common_voice_en_38311161.mp3
" Over the following six weeks, the Canadian border officially remained closed.",common_voice_en_38398152.mp3
" Although technically an underground, most of the system's track length is above ground.",common_voice_en_38359871.mp3
 Miles became a voice teacher at the Otago post lesson.,common_voice_en_38366896.mp3
 Thank you.,common_voice_en_38487402.mp3
 The film ends with the voiceover. May the fares be with you.,common_voice_en_38100377.mp3
 The receiver provides an hour to the pilot if the consistent checks fail.,common_voice_en_38115975.mp3
 The prestige that acquired led to his appointment as prefect of Palermo.,common_voice_en_38041711.mp3
 All deaths have been ruled as an undermined or accidental drowning.,common_voice_en_38111523.mp3
 The early in the first North American Fair Award,common_voice_en_38342921.mp3
" There are six academic buildings, on-campus housing, classrooms and faculty offices.",common_voice_en_38334849.mp3
 Her hen wants peace with sow and does not desire occupation by king.,common_voice_en_38099754.mp3
 The band lays film in dress a very limited theatrical release.,common_voice_en_38031634.mp3
" His contribution to Atiguru design included set gimbal, rotor head,",common_voice_en_38078967.mp3
 Increasing truck transportation on the road had an effect on buses on the train.,common_voice_en_38043728.mp3
 I'm working my ass off.,common_voice_en_38390051.mp3
 What's of it to say that earth is not hateful or malicious?,common_voice_en_38329749.mp3
 Is all string long the food of the difference for present future season?,common_voice_en_38384581.mp3
 A man who has killed an enemy paints a red circle around his eye.,common_voice_en_38265179.mp3
 Sitten dualistitoktuus on mytinen analytinen mielipite.,common_voice_en_38118473.mp3
 Syrinx was then taken by Siege.,common_voice_en_38359045.mp3
 Magic regularly dwindles into divination before it degenerates into a simple game.,common_voice_en_38266262.mp3
 It took three weeks to paint.,common_voice_en_38347118.mp3
 Monoids and groups can be thought of as categories with a single element.,common_voice_en_38153467.mp3
 Hallelujah,common_voice_en_38424949.mp3
