en_text,file_names
 The children of such marriages are raised by the mother's extended matrilineal clan.,common_voice_en_38206988.mp3
" He served in the Plastic Surgery Unit at Valley Force General Hospital, Penislavina.",common_voice_en_38346571.mp3
 The egg case curiously resembles the shells of extinct ammonites.,common_voice_en_38403275.mp3
" The mind casts off its formibus and may merely be well-made, required.",common_voice_en_38099618.mp3
 Breaking a leaf or twig from the warden tree was considered a serious offense.,common_voice_en_38359042.mp3
 Greg began his education at Lanik Grammar School.,common_voice_en_38041663.mp3
" Here listed at the start of the webinar, Quote Master's Department.",common_voice_en_38176595.mp3
 He is the younger brother of former San Diego Chargers running back Terrell Fletcher.,common_voice_en_38201176.mp3
 Thank you.,common_voice_en_38419359.mp3
ตอนนี้น้อยพัดขึ้นลวกบัวซุกก่อนนะ ลวกไปเป็นเลือดแดงๆ,common_voice_en_38303167.mp3
 The whisky has been known to become as white as milk.,common_voice_en_38265960.mp3
 You,common_voice_en_38448288.mp3
 The mummery has been shorn of some of its ancient features.,common_voice_en_38291639.mp3
 This plant has one wasting house project or target.,common_voice_en_38081484.mp3
 ത്ത്ത്ത്ത്ത്ത്ത്ത്ത്ത്ത്ത്ത്ത്ത്ത്ത്ത്ത്ത്ത്ത്ത്ത�,common_voice_en_38346639.mp3
 This was an idea discussed in Europe and America in the 18th century.,common_voice_en_38059415.mp3
 Cindy is the sister of original Alice Cooper drummer Neil Smith.,common_voice_en_38064152.mp3
 The facilities have been restored except for the nearby airstrip.,common_voice_en_38400797.mp3
 Then I lost touch with my Savior Jesus Christ.,common_voice_en_38356212.mp3
 Thank you.,common_voice_en_38448665.mp3
 Green Hills College also provides post-leaving certificate and adult education courses.,common_voice_en_38052542.mp3
 Shabazzu was offered the Anglican bishopry,common_voice_en_38166182.mp3
 This may have been no more than a fulsome compliment.,common_voice_en_38300295.mp3
 Snow fences have been reported to save lives and reduce maintenance costs.,common_voice_en_38330368.mp3
 Parvastatin acts as a lipoprotein lowering drug to pathways.,common_voice_en_38092028.mp3
" The English form, Mesia, is derived from the Aramaic through the creek.",common_voice_en_38325823.mp3
 The company was subsequently renamed Kokija,common_voice_en_38056453.mp3
 They also disagreed that the game was focused on rape and misogyny.,common_voice_en_38390335.mp3
" O God, I can well of amma, room could call it a preposterous remark.",common_voice_en_38025734.mp3
 Salmer and Abu Kuhafer had several sons who did not survive infancy.,common_voice_en_38050587.mp3
 Koalas can only be seen in Austria.,common_voice_en_38053488.mp3
 Everyone who has slain a foe in the battle steps forth.,common_voice_en_38265430.mp3
" Peterson's government, however, had no better solution to the depressed state of Victoria's government.",common_voice_en_38361720.mp3
 All residents are zoned to Dr. Phillips High School.,common_voice_en_38159401.mp3
 One major area of activity for the committee is energy policy safety and efficiency.,common_voice_en_38220542.mp3
 Pieces of all the various shapes of the royal coffers.,common_voice_en_38354215.mp3
" When held in the Astrodome, it was called the Astro Blue Bullet Ball.",common_voice_en_38155824.mp3
 Cutforth is also the headquarter of the West Coast Railway Company.,common_voice_en_38038361.mp3
" Within Town and Country are located Baycrest Park, Country Way, Rocky Creek, Sweetwater Creek.",common_voice_en_38132302.mp3
 NG NG,common_voice_en_38424782.mp3
 Low volatility is important in lunar vacuum conditions.,common_voice_en_38214751.mp3
 Thank you.,common_voice_en_38449223.mp3
 How close is set of interventions in causes?,common_voice_en_38274885.mp3
 Dei town of Isra is located on it.,common_voice_en_38329001.mp3
 Thank you.,common_voice_en_38420679.mp3
" This wolf was particularly influential, for example, on hills of Bush.",common_voice_en_38070440.mp3
 The song also reached the top of the official German single charts.,common_voice_en_38050340.mp3
" After graduating, she moved to New York.",common_voice_en_38383229.mp3
 It is the historical main taro sector of Macau.,common_voice_en_38329002.mp3
 Дякую!,common_voice_en_38257720.mp3
" This is ambiguous, of course, but it might call even more videos into question.",common_voice_en_38265181.mp3
 He obtained his graduate education from Butler University.,common_voice_en_38413098.mp3
" The church, which is dedicated to St. Nicholas, serves both as Queen Hill and Holdfast.",common_voice_en_38070643.mp3
 Tuus soltum svae cuilte et scord et desaite.,common_voice_en_38354200.mp3
" Daily variety named Bizen Ghast, one of Tokyo Pop's top 10 biggest titles.",common_voice_en_38166236.mp3
 It is an anachronism for you to have such thoughts.,common_voice_en_38293416.mp3
 His professional relationship with Ross continued by writing material for his stage act.,common_voice_en_38024777.mp3
 It is a fishing and leisure port on the Kanchi River.,common_voice_en_38108856.mp3
 ཁཱཱཱཱཱཱཱཱཱཱཱཱཱཱཱཱཱཱཱཱཱཱཱཱཱཱཱཱཱཱཱཱཱཱཱཱཱཱཱཱ�,common_voice_en_38028947.mp3
 Lafayette is the birthplace of heavyweight boxing champion Joe Louis.,common_voice_en_38337605.mp3
" The symptomatic carriers will show no signs of disease, often for many years.",common_voice_en_38369035.mp3
 I need someone to show me the things in life that I can't find.,common_voice_en_38291835.mp3
 Twin Lake Properties Residential High Income Properties,common_voice_en_38156685.mp3
 Triangle motifs appear on many post-war memorials to victims of the Nazis.,common_voice_en_38384587.mp3
 Checkup nevertheless often receives calls from callers outside Canada.,common_voice_en_38028950.mp3
 Thank you.,common_voice_en_38450604.mp3
" Using field turf, the plane surface is roughly below ground level.",common_voice_en_38155763.mp3
 Thank you.,common_voice_en_38461208.mp3
 The figures of the two goddesses resolve themselves into figures of the corn.,common_voice_en_38280130.mp3
 Thank you.,common_voice_en_38358834.mp3
 He worked in the Indian Civil Service.,common_voice_en_38039524.mp3
 Galloway attended Hunter College High School in New York.,common_voice_en_38039901.mp3
 It also contains hymns and titani all with musical notation.,common_voice_en_38111860.mp3
 Most commuters in China's specs travel from each way.,common_voice_en_38361640.mp3
 The front measure strike is usually about 1 cm in width.,common_voice_en_38336041.mp3
 Thank you.,common_voice_en_38449023.mp3
 This species has one of the widest ecological distributions of all of the buckwheats.,common_voice_en_38123781.mp3
" Fort William Football Club is a senior football team from Fort William, Lodger, Baskotland.",common_voice_en_38029468.mp3
 The player controls the army trying to protect Japan from the Godzilla characters.,common_voice_en_38127493.mp3
" See you, girl.",common_voice_en_38473989.mp3
 Thank you.,common_voice_en_38451068.mp3
 The secession to the throne fell to the king's assassin.,common_voice_en_38318747.mp3
" portfolio, demo yourself and domain overflow that as well.",common_voice_en_38394742.mp3
 They appointed sacrifice and popular festivities in honor of each of the two godness.,common_voice_en_38315467.mp3
 This variation may lie in between the conversative and modified forms.,common_voice_en_38245508.mp3
 I don't know what to say.,common_voice_en_38471769.mp3
 very fun is odd,common_voice_en_38356372.mp3
" If and when the signal degrades, another antenna is switched in.",common_voice_en_38180599.mp3
" Uptown Oxford is known for its local shops, restaurants, and nightlife.",common_voice_en_38353430.mp3
 This area experiences regular hailstones and some of the coolest weather in the Philippines.,common_voice_en_38027447.mp3
" Like most other Mayan languages, Classic Maya is a verb-subject-object and is an ergative",common_voice_en_38156651.mp3
" She is the mother of two teenagers, Thomas and Adonis.",common_voice_en_38235212.mp3
" When the player ends the turn, all ally parties will move simultaneously.",common_voice_en_38225566.mp3
 Thank you.,common_voice_en_38471386.mp3
 He is a six-time All-Star and a two-time Silver Slug Award winner.,common_voice_en_38025695.mp3
 He knows that the time of her mourning is over.,common_voice_en_38265343.mp3
 Do you see something in Farsi?,common_voice_en_38422482.mp3
 Psychology has historically reeled on experiments and questionnaires in order to collect data.,common_voice_en_38358229.mp3
 He turned to acting at the time as playwright Athol Fagad was imaging.,common_voice_en_38099395.mp3
 Mansell took a comfortable win with Senna holding second after Alberto's terrible experience problems.,common_voice_en_38357905.mp3
 The king must open the festival wherever he is.,common_voice_en_38313942.mp3
 Freeman was initially convicted and lost on appeal to the California Court of Appeal.,common_voice_en_38084846.mp3
" Shortly afterwards, the band discovered that another band was using the name Cardiac Arrest.",common_voice_en_38374489.mp3
 He is also an echo to actresses Rooney Mara and Kate Mara.,common_voice_en_38124776.mp3
 Sometimes it is made so heavy that a man can barely lift it.,common_voice_en_38286806.mp3
 Davidson Spurridge joined a family firm then known as Shea.,common_voice_en_38346605.mp3
 It is viewed as the stainless cup of woman's hockey.,common_voice_en_38314960.mp3
 ПЕСНЯ,common_voice_en_38424768.mp3
 These foods are selected for preservation in Bangladesh Cream Agaric too.,common_voice_en_38079705.mp3
 They are contraindicating in variant angina and can precipitate heart failure.,common_voice_en_38153106.mp3
 It engaged in both public and private sector development across many different sectors.,common_voice_en_38125912.mp3
 Neither is lasting.,common_voice_en_38166194.mp3
 One officer escaped from the flooded Komin Tower and was rescued with their others.,common_voice_en_38025723.mp3
 He then went to Breslau and Munege to study theology.,common_voice_en_38377196.mp3
 It was the Charles N. Skiverian Railways' fourth locomotive.,common_voice_en_38035526.mp3
 The Canadian Medical Association ordered the journal to comply.,common_voice_en_38401688.mp3
" The town's name derives from Archangel Michael, who was also considered its patron.",common_voice_en_38028762.mp3
" Strictly speaking, the hoop should be wrapped in white linen and cut chips.",common_voice_en_38025913.mp3
 Thank you.,common_voice_en_38448507.mp3
 Thank you.,common_voice_en_38449354.mp3
 Human-based genetic algorithm is one possible model to design such an organization.,common_voice_en_38355733.mp3
 Thank you.,common_voice_en_38420652.mp3
 Jim Bradley took his place until the Leadership Convention.,common_voice_en_38155414.mp3
 Police were not present initially in the area and arrived almost an hour later.,common_voice_en_38033545.mp3
" In Cyprus, there was a bearded and masculine image of Venus in female attire.",common_voice_en_38324136.mp3
 Thank you.,common_voice_en_38414913.mp3
 she went on to write several action novels based in exotic historical settings,common_voice_en_38059576.mp3
 The winners include Trans Resource Corporation for the Kalina Jane Line Extension.,common_voice_en_38124990.mp3
 Aaaaaaaaaaaaaaaaaaaaaaaaaaaaaaaaaaaaaaaaaaaaaaaaaaaaaaaaaaaaaaaaaaaaaaaaaaaaaaaaaaaaaaaaaaaaaaaaaaaaaaaaaaaaaaaaaaaaaaaaaaaaaaaaaaaaaaaaaaaaaaaaaaaaaaaaaaaaaaaaaaaaaaaaaaaaaaaaaaaaaaaaaaaaaaaaaaaaaaaaaaaaaaaaaaaaaaaaaaaaaaaaaaaaaaaaaaaaaaaaaaaaaaaaaaaaaaaaaaaaaaaaaaaaaaaaaaaaaaaaaaaaaaaaaaaaaaaaaaaaaaaaaaaaaaaaaaaaaaaaaaaaaaaaaaaaaaaaaaaaaaaaaaaaaaaaaaaaaaaaaaaaaaaaaaaaaaaaaaaaaaaaaaaaaaaaaaaaaaaaaaaaaaaaaaaaaaaaaaaaaaaaaaaaaaaaaaaaaaaaaaaaaaaaaaaaaaaaaaaaaaaaaaaaaaaaaaaaaaaaaaaaaaaaaaaaaaaaa I'm going to go ahead and get my camera out of the way. I'm going to go ahead and get my water bottle. I'm going to go ahead and get my water bottle. I'm going to go ahead and get my water bottle. I'm going to go ahead and get my water bottle. I'm going to go ahead and get my water bottle. I'm going to go ahead and get my water bottle. I'm going to go ahead and get started. I'm going to go ahead and get started. I'm going to go ahead and get started. I'm going to go ahead and get started. I'm going to go ahead and get started. I'm going to go ahead and get started. I'm going to go ahead and get started. I'm going to go ahead and get started. I'm going to go ahead and get started. I'm going to go ahead and get started. I'm going to go Thank you.,common_voice_en_38194114.mp3
" At lap level, Ricard was a four-time Conti-lap championship medallist with Ruthenia.",common_voice_en_38029736.mp3
 Thank you.,common_voice_en_38420719.mp3
 Thank you.,common_voice_en_38450995.mp3
 He began his youth career as a ranger and started his senior career as a forecook.,common_voice_en_38396221.mp3
 mechanical metronomes do not need a battery but run from a spring-wound clock escapement,common_voice_en_38121593.mp3
 Dave introduced every episode with a monologue that typically segued into the first sketch.,common_voice_en_38329639.mp3
 The rear is brought up by a cart laden with barrels of wine.,common_voice_en_38297289.mp3
 Thank you.,common_voice_en_38078037.mp3
" After the battle, the Maritsa ran scarlet with blood.",common_voice_en_38146293.mp3
 McGonigle hapa kutoka kwa cha kwa kwa kwa kwa kwa kwa kwa kwa kwa kwa kwa kwa kwa kwa kwa kwa kwa kwa kwa kwa kwa kwa kwa kwa kwa kwa kwa kwa kwa kwa kwa kwa kwa kwa kwa kwa kwa kwa kwa kwa kwa kwa kwa kwa kwa kwa kwa kwa kwa kwa kwa kwa kwa kwa kwa kwa k,common_voice_en_38155602.mp3
 Thank you.,common_voice_en_38058737.mp3
 The great lord has related himself with the great lady.,common_voice_en_38274926.mp3
 In Muffin syndrome there is a defect in the fibrin that like a protein component of microfibrils.,common_voice_en_38099430.mp3
 Heracastopenta was the great Patco Valideres.,common_voice_en_38111726.mp3
" Kwa hivyo, kwa hivyo, kwa hivyo, kwa hivyo, kwa hivyo, kwa hivyo, kwa hivyo, kwa hivyo, kwa hivyo, kwa hivyo, kwa hivyo, kwa hivyo, kwa hivyo, kwa hivyo, kwa hivyo, kwa hivyo, kwa hivyo, kwa hivyo, kwa hivyo, kwa hivyo, kwa hivyo",common_voice_en_38066381.mp3
 Thank you.,common_voice_en_38487389.mp3
 She also spent time in Cuba where she studied the Borrero.,common_voice_en_38155951.mp3
 Ronconi investigated a long line of great Italian baritones that continued into modern times.,common_voice_en_38229377.mp3
 Every man does what seems good in his own eyes.,common_voice_en_38273680.mp3
 إنه رقم الثاني في مجال التاريخ المتحدث عن كربونس هاي في المدينة.,common_voice_en_38163616.mp3
 Their aim is not to demonstrate the superior strength and skill of the victors.,common_voice_en_38305851.mp3
 Its main entrance is located on shore drive across from the beach camping entrance.,common_voice_en_38099630.mp3
 This is the prototypical example of ballen rings.,common_voice_en_38026759.mp3
 It is the town's major tourist attraction.,common_voice_en_38025090.mp3
 An additional adjustment can be added to reduce the maximum relative error.,common_voice_en_38165304.mp3
 That general law is stated thus by the Hebrew legislator.,common_voice_en_38257456.mp3
 Lickenhead idolized his older brother whom he described as cool.,common_voice_en_38400218.mp3
 Hüte den Popal,common_voice_en_38320970.mp3
 Hazard is now in the pop-punk band McCracken.,common_voice_en_38078382.mp3
 Values for some industrial solid leaches are given in the table below.,common_voice_en_38059428.mp3
 The saving of the soul is combined with a vicarious sacrifice to the ghost.,common_voice_en_38126942.mp3
 Many government policies were aimed at restoring the confidence of the private sector.,common_voice_en_38030661.mp3
 This phenomena of suppression did not extend to the entire image.,common_voice_en_38153299.mp3
 Vehicles were also produced in knockdown kits and sent to the branch assembly locations.,common_voice_en_38365586.mp3
 Lucian states that Apollodorus died at the age of 82.,common_voice_en_38117424.mp3
" During the fourth week in April, she finally developed the star-crossed teeth.",common_voice_en_38347082.mp3
" Lucas Tota, Lisa Lucas is Executive Director of the National Book Foundation.",common_voice_en_38355647.mp3
 He happened to be in Cebu when the war broke out.,common_voice_en_38229412.mp3
 The director reports yearly to the General Assembly on the activities of the Institute.,common_voice_en_38139861.mp3
 The film's writer John Fowler has a minor role as the board captain.,common_voice_en_38377234.mp3
 Harrington says history is regarded as an endless cycle of death and rebirth.,common_voice_en_38383438.mp3
 you,common_voice_en_38390108.mp3
 Four concrete pairs support the steel roof with no interior columns required.,common_voice_en_38026606.mp3
" Itiwa inikasne, thonku ene modberi hundred and tenet inches wa Winchester Bay.",common_voice_en_38080405.mp3
 Thank you.,common_voice_en_38334867.mp3
 A new baby will sometimes be put into an old winnowing basket at birth.,common_voice_en_38275797.mp3
" Rá, o Tau-Hans, a la Ars, a Félix e o Machioliti.",common_voice_en_38398219.mp3
 Her gay is a member of a political family.,common_voice_en_38124788.mp3
 A product's economy is funded basically in manufacturing operations and services.,common_voice_en_38031391.mp3
 Thank you.,common_voice_en_38449397.mp3
 Linden Coach L. Johnson is the assistant principal.,common_voice_en_38084515.mp3
 He also testified on occasion as an expert witness at Vatican criminal proceedings.,common_voice_en_38098895.mp3
 Whitefly are an English pest of greenhouse crops such as cucumber and tomato.,common_voice_en_38029132.mp3
" Jim in the second book, he commanded a long-winded teaser coming.",common_voice_en_38038362.mp3
 I had the honour of being presented to His Majesty by Sir William MacGregor.,common_voice_en_38304387.mp3
 The Egyptian harvest was not in autumn but in spring.,common_voice_en_38313969.mp3
" I've never played this game, so I agreed to do it twice.",common_voice_en_38419399.mp3
 .,common_voice_en_38324730.mp3
 His graphite and petroleum jelly drawings represent key aspects of the project's conceptual framework.,common_voice_en_38134028.mp3
 delicious round red and green bean pastries sold at a stand near the entrance,common_voice_en_38026821.mp3
 This ensured that southern states could continue to practice discrimination against black Victorians.,common_voice_en_38376922.mp3
" In the end, however, Toyota's aggressive defensive strategy did not pay off.",common_voice_en_38400225.mp3
 No entry fee applies for the park and no facilities are available to visitors.,common_voice_en_38220557.mp3
 Warheads of broader hillsides by dirtmen was another useful gallop.,common_voice_en_38050142.mp3
 Parties head office refused to accept Cassie's nomination and suspended the association's board.,common_voice_en_38089999.mp3
 These sections were likely composed in different time periods by different otas.,common_voice_en_38325766.mp3
 안다.,common_voice_en_38368061.mp3
 Thank you.,common_voice_en_38414899.mp3
" His Victoria Cross is the place of the Northland Rhesus Museum, High Week, Northland Plain.",common_voice_en_38079706.mp3
" Ayala, then a lieutenant, was one of those assigned to the naval expedition.",common_voice_en_38395676.mp3
 The album was recorded around the same time as Lennon's Imagine.,common_voice_en_38057149.mp3
 يا رجال يوسف، ما الذي يفعله؟,common_voice_en_38302090.mp3
 of my existence.,common_voice_en_38419776.mp3
 Thank you.,common_voice_en_38413891.mp3
 Practically all schools of novism adhere to this viewpoint.,common_voice_en_38413106.mp3
 Thank you.,common_voice_en_38448076.mp3
 Thank you.,common_voice_en_38424387.mp3
 The tracks are still in existence.,common_voice_en_38352880.mp3
 Thank you.,common_voice_en_38471556.mp3
" She was born in Moran, Ohio.",common_voice_en_38235210.mp3
 ਹੇ ଲੀੱੇরੇরੇরੇরੇরੇরੇরੇরੇরੇরੇরੇরੇরੇরੇরੇরੇরੇরੇরੇরੇরੇ�,common_voice_en_38099143.mp3
 RAND goes on to divide artistic endeavors into valid and invalid forms.,common_voice_en_38037497.mp3
" At the end of the campaign, Rick Bitt imparted company with manager Dave Stringer.",common_voice_en_38034558.mp3
 Former House of Representatives Speaker John Boehner resides in Wetherington.,common_voice_en_38233307.mp3
 Assistant coach Scott Camperill was appointed interim coach for the remainder of the season.,common_voice_en_38362177.mp3
 Shadows of extraordinary confidence,common_voice_en_38390135.mp3
 This knot is also called the adjustable loop and the corally adjustable hitch.,common_voice_en_38039447.mp3
 Chemical King is a mutant with the power to act as a human catalyst.,common_voice_en_38077674.mp3
 The name of Putuo District comes from Putuo rules located within the district.,common_voice_en_38079074.mp3
" In geological and petrochemical engineering, this effect is known as the Klinkenbach effect.",common_voice_en_38111861.mp3
" Located in central Illinois, it is southeast of Peoria.",common_voice_en_38362981.mp3
 What is it now about Search Your Souls,common_voice_en_38050343.mp3
" Aram, with a fleece of gold, opened his lips.",common_voice_en_38265396.mp3
 The quarry survives to this day although it is now operated by aggregate industries.,common_voice_en_38358017.mp3
 Thank you.,common_voice_en_38421014.mp3
 The stocks in the branch must be nine in number.,common_voice_en_38284579.mp3
 Universal originally envisioned the attraction as the crown jewel of the Florida park.,common_voice_en_38070326.mp3
" On Logan, this is weapon extract and jumps on it.",common_voice_en_38081645.mp3
 Slowfoot was probably one of the smallest of these.,common_voice_en_38129695.mp3
 His famous work is probably the name series from Bill O'Rourke and Boy Scouts.,common_voice_en_38361642.mp3
 The figure is dressed up in the holiday attire of a young peasant woman.,common_voice_en_38265383.mp3
" Lynette's father, Rodney Scarvo, arrives in town on business and stays with them.",common_voice_en_38235365.mp3
 Thank you.,common_voice_en_38413885.mp3
 Chronomers can be observed best when chromosomes are highly condensed.,common_voice_en_38033778.mp3
 Water also appears to disobey the law of conservation of energy.,common_voice_en_38176636.mp3
 The piece was Kalman's first operetta and a hit throughout Europe and America.,common_voice_en_38220378.mp3
 Breeders of guinea pigs.,common_voice_en_38213174.mp3
 They march behind the girl who wears the breath to the squire's house.,common_voice_en_38285840.mp3
 The traveller was regarded as a spirit by these simple-minded folk.,common_voice_en_38304386.mp3
" ...very, very good organization.",common_voice_en_38058736.mp3
 Radicchio matures in approximately three months.,common_voice_en_38062053.mp3
" However, he is eventually shot and killed by Kennard, a young Stanfield dealer.",common_voice_en_38130449.mp3
" However, south of this land, Parishes tended to contain Sumi townships.",common_voice_en_38313994.mp3
 The move is that Fernando Poe Jr. and Edna Luna.,common_voice_en_38377034.mp3
 لا إله إلا الله محمد رسول الله,common_voice_en_38210244.mp3
" In his medical studies at the University of Glasgow, Broom specialized in midwifery.",common_voice_en_38032116.mp3
 His journey records were recorded for the North Carolina-based Colonial Records Label.,common_voice_en_38126201.mp3
" Between his father and Harriton, what playmates and instructor there will be.",common_voice_en_38033395.mp3
 Why wouldn't you stop using it after the first hole?,common_voice_en_38277619.mp3
 Its county seat is Robinson.,common_voice_en_38400437.mp3
 The series failed to sell at that time and the pilot was never broadcast.,common_voice_en_38226053.mp3
 There is now a middle plane in the middle of the axis.,common_voice_en_38039861.mp3
 I want to be the opposite of an escape artist.,common_voice_en_38275796.mp3
 Their attempt failed and they fled to Armenia.,common_voice_en_38222340.mp3
 The view is especially impressive when the sun floods the gorge with golden light.,common_voice_en_38269747.mp3
 Thank you.,common_voice_en_38461209.mp3
 Blūd akšēs atsakīt pēdējākālā vēl otrā cīs.,common_voice_en_38341787.mp3
 The center attracted over 1 million visits in its first year of opening.,common_voice_en_38346613.mp3
 cooks is robbed several times by it forth and other denizens of the fair,common_voice_en_38040226.mp3
 The city was founded as a military stronghold by the imperial Russian,common_voice_en_38035726.mp3
 It's gone.,common_voice_en_38166592.mp3
 The game is based on the Tom Clancy's book.,common_voice_en_38028774.mp3
 Thank you.,common_voice_en_38420862.mp3
 Peterson was a parishioner of the London Oratory.,common_voice_en_38369037.mp3
 Kirsten's son began his playing career with McKay and Queensland.,common_voice_en_38053500.mp3
 Thank you.,common_voice_en_38449545.mp3
 These fossils may also point towards an Australian origin for the genus.,common_voice_en_38114845.mp3
 He routinely fought barehanded against quartets of policemen armed with wooden clubs.,common_voice_en_38052621.mp3
 The version had on Sailway is a re-recording with a notably different arrangement.,common_voice_en_38035646.mp3
 Aristotle attempts several proofs of this law.,common_voice_en_38079117.mp3
