en_text,file_names
 The current patron is His Excellency the Right Honourable David Johnston.,common_voice_en_38136204.mp3
 The term speakeasy was introduced when the company was branded as ESET Digiphone.,common_voice_en_38098882.mp3
 Fenele was born in New York the second of three children.,common_voice_en_38116538.mp3
" Astounded by the find, Linfleda was soon joined by a number of folk.",common_voice_en_38028827.mp3
 Bye.,common_voice_en_38419204.mp3
 The phrase also appears in Sting's song Russians.,common_voice_en_38398623.mp3
 There have also been two railway bridges in Delman Rock crossing the river Clyde.,common_voice_en_38357291.mp3
 He has also served on the university's Board of Associates.,common_voice_en_38404644.mp3
" Suleyman drove out Ferdinand, then put Central Hungary under direct Turkish rule.",common_voice_en_38062084.mp3
 He is venerated as the same by both Roman Catholics and Eastern Orthodox.,common_voice_en_38346822.mp3
" The specific epithet, cremata, means scalloped and refers to the edges of the leaves.",common_voice_en_38394965.mp3
 Anubis Chase is a criminal prosecutor with a near perfect conviction record.,common_voice_en_38236269.mp3
 The largest sheaf is regarded as the seed of the rice sown.,common_voice_en_38296169.mp3
 he yelled all women of kilan and belton are wipers,common_voice_en_38226319.mp3
 Surface chemistry can be roughly defined as the study of chemical reaction at antifaces.,common_voice_en_38033791.mp3
 A bronze bust of Alexandre Binet is in the Wellcome Collection in London.,common_voice_en_38032465.mp3
 He was the son of William de Peto and John Donberry.,common_voice_en_38376936.mp3
" Towards the end of the meal, the horse opens the window.",common_voice_en_38330815.mp3
 which later ignited a fire by friction with Mike Wallace's car.,common_voice_en_38141930.mp3
 T. Colton slowly resumed his activities as a jeweller in Japanese art.,common_voice_en_38050585.mp3
 her welfare allowances were discontinued leaving her family in severe financial difficulties,common_voice_en_38062655.mp3
 Thank you.,common_voice_en_38448103.mp3
" The film is now run by John Rutherford, who will be the son.",common_voice_en_38332225.mp3
 Thank you.,common_voice_en_38420730.mp3
 He resolves to improve himself and travels to Paris where he becomes a sensation.,common_voice_en_38220569.mp3
 their souls shone as bright as stars in the firmaments,common_voice_en_38291766.mp3
 Dol Guelau is the main base for the timbers of Cadere and Ruiz.,common_voice_en_38089964.mp3
" The elections include Love Me Tonight, Nocturne, Only a Rose and The Drinking Song.",common_voice_en_38099340.mp3
 The book evokes the same cynicism about nationalism but in a Canadian context.,common_voice_en_38056490.mp3
 Mary was daughter of Alice Freeman Thompson Park.,common_voice_en_38220541.mp3
 Brass is cheap but light and therefore brass barrels tend to be very bulky.,common_voice_en_38328042.mp3
 The oatscote is in the last sheaf of oats.,common_voice_en_38272832.mp3
" To support such mission, tanker aircraft version of old 3D design were developed.",common_voice_en_38327951.mp3
 This project features acoustic versions of Easy Peel and Leave in Tennessee.,common_voice_en_38166584.mp3
 From its headwaters it flows to its confluence with the Murari River.,common_voice_en_38319249.mp3
 There have been proposals for a separated bike lane to be installed.,common_voice_en_38109169.mp3
 He repeatedly emphasizes the very great age of polycarp.,common_voice_en_38064151.mp3
 Several improvements over exist on this ship and all following Aral Borg class destroyers.,common_voice_en_38358217.mp3
 The entrance to the smaller chamber is guarded on either side.,common_voice_en_38265169.mp3
 The effect of the law became noticeable almost immediately.,common_voice_en_38220637.mp3
 Thank you.,common_voice_en_38461234.mp3
 During the Nazi era he had a production at Tubis Film and Belim Film.,common_voice_en_38100213.mp3
" Pietro Cori, referring to Casiero, remembered him as a generous person.",common_voice_en_38357332.mp3
" Aloe vera, som er vandet fra Nordkøben, gør området vel sættet til at skabe grøntsager.",common_voice_en_38035530.mp3
 Reid also defeated Mandlikova in both of their career matches.,common_voice_en_38235416.mp3
" Carlo Menno was touched by a boat for Wolfen, a featured bishop.",common_voice_en_38079667.mp3
 She immediately opened a brisk cannonade and after an hour the Confederates withdrew.,common_voice_en_38126956.mp3
 This test was conducted in a lakefront harbor in the western province of Manitoba.,common_voice_en_38355727.mp3
" Each face of the pot has three impressions, one above the other.",common_voice_en_38026612.mp3
 She spreads false rumors that Bershmish filled his virtues among their friends.,common_voice_en_38164965.mp3
 برگردان همه ترکیز ها برای قدرت را به نقش ندارد، با قدرت های نقش ندارد.,common_voice_en_38035243.mp3
 It became sufficiently popular to be subsequently reproduced in smaller versions in brass.,common_voice_en_38129682.mp3
" Fast food may be healthier than preserved food, but unhealthy compared to organic produce.",common_voice_en_38056082.mp3
 Thank you.,common_voice_en_38257721.mp3
 Teksting av Nicolai Winther,common_voice_en_38413853.mp3
 Mente World is located in the province of Groeningen in the northeast of the Netherlands.,common_voice_en_38100371.mp3
 They later rescued the scientists.,common_voice_en_38404653.mp3
 The Germans of Bohemia observe All Souls' Day with much solemnity.,common_voice_en_38265156.mp3
 The committee meets quarterly and has representation from every region of the country.,common_voice_en_38341427.mp3
 That's either corny.,common_voice_en_38419831.mp3
" For this reason, the city has never allowed the mound to be excavated.",common_voice_en_38233310.mp3
 Thank you.,common_voice_en_38451122.mp3
" These contracts can include sports prices, forwards, futures and options on futures.",common_voice_en_38029708.mp3
 She was a great fan of the fitness of her dove at home.,common_voice_en_38320967.mp3
 Thank you.,common_voice_en_38448303.mp3
 The Cambridge Shire Guided Busway passes through South Cambridge Shire.,common_voice_en_38233270.mp3
 This is a video of a video of a video of a video of a video of a video of a video of a video of a video of a video of a video of a video of a video of a video of a video of a video of a video of a video of a video of a video of a video of a video of a video of a video of a video of a video of a video of a video of a video of a video of a video of a video of a video of a video of a video of a video of a video of a video of a video of a video of a video of,common_voice_en_38419775.mp3
 Among his properties were the famed May Castle complex and the Kai Palace.,common_voice_en_38376881.mp3
" As a Privy Councillor, he was influential on a number of committees.",common_voice_en_38393367.mp3
 The dish is prepared on the morning of the feast.,common_voice_en_38305674.mp3
" Paul Desmarais, Winnie the French, Paul and Sacred Heart, and Frederic Bunting, Winnie the Pooh.",common_voice_en_38334053.mp3
 The ship had started to take on water through a hole in her hull.,common_voice_en_38403922.mp3
 The municipal offices are at the village of Badeg.,common_voice_en_38087815.mp3
 Rukka and Jones saw this ending as both pragmatic and romantic.,common_voice_en_38148043.mp3
 He had neither money nor a travel plan.,common_voice_en_38413099.mp3
" In the answer turned to of the whole question, I leave my theory as it stood.",common_voice_en_38300280.mp3
 Then came to the first children's rep groups such as Los Marginales and Pantaras Negros.,common_voice_en_38115967.mp3
" During his reign, the city of Rome celebrated its millennium.",common_voice_en_38237610.mp3
 but also can be Spanish last name,common_voice_en_38341356.mp3
 the spanish eclectic exterior was finished in stucco which was painted an earthy yellow,common_voice_en_38146092.mp3
 How did the man named Siddhartha became an enlightened one?,common_voice_en_38357331.mp3
 They perch on honeycombs and feed on wikes.,common_voice_en_38099369.mp3
 Timmy John Manuel Fangcio was second in a sister car.,common_voice_en_38366528.mp3
" Kwa hivyo, kwa hivyo, kwa hivyo, kwa hivyo, kwa hivyo, kwa hivyo, kwa hivyo, kwa hivyo, kwa hivyo, kwa hivyo, kwa hivyo, kwa hivyo, kwa hivyo, kwa hivyo, kwa hivyo, kwa hivyo, kwa hivyo, kwa hivyo, kwa hivyo, kwa hivyo, kwa hivyo",common_voice_en_38089620.mp3
 The midwife carries the crocodile twin carefully down to the river.,common_voice_en_38280873.mp3
" The elections were considered transparent, free and fair.",common_voice_en_38398795.mp3
" The title incorporates two previous local papers, the Tipperary Vindicator and the Nenak News.",common_voice_en_38328724.mp3
" Typical construction materials include metal tubing, ladder line, or twin lead.",common_voice_en_38235239.mp3
" Recurring themes in our things catalog included sex, heartbreak, decapitation, aliens, hot dogs and poultry.",common_voice_en_38111727.mp3
 That is why you exposed deadlock on the farmland.,common_voice_en_38274891.mp3
" For a fuller description of the fact it attempts to explain, see Pen Effect.",common_voice_en_38130461.mp3
 They are usually windows or old mince-in-vent of the deceased king.,common_voice_en_38260417.mp3
" A month after leaving West Ham and United, O'Brien testified in court in Ackerman's trial.",common_voice_en_38125247.mp3
 He played his junior career with the Windsor Spitfires of the Ontario Hockey League.,common_voice_en_38382530.mp3
" 40,000 fighting men were gathered there to defend the king.",common_voice_en_38304595.mp3
 The commandos consist of pvt,common_voice_en_38099155.mp3
 The points of similarity to the ritual of Dionysus are sufficiently obvious.,common_voice_en_38281199.mp3
 Thank you.,common_voice_en_38424379.mp3
 In this hut she must bring forth her offspring unaided.,common_voice_en_38265624.mp3
 Their proceedings have been held in secret and defendants could not confront their accusers.,common_voice_en_38092029.mp3
 The circumstances of his private life were revealed and returned to London.,common_voice_en_38080001.mp3
" Similarly, the Romans called Corona Australias the woven crown of Sagittarius.",common_voice_en_38354412.mp3
 Both times were over a minute of the next slowest competitor in each race.,common_voice_en_38028833.mp3
 The Sod Church still holds services.,common_voice_en_38251807.mp3
" After touring in support of the album, Gittery Sydney left the band.",common_voice_en_38166183.mp3
 Ecoregions are listed by biome.,common_voice_en_38394621.mp3
" Now, two sides of the square's Georgian terracing are identical.",common_voice_en_38159372.mp3
" Though Salteo showed motion pictures, there were other theaters more convenient to town.",common_voice_en_38027646.mp3
 People here come from the field of primary schools in the town and neighbouring places.,common_voice_en_38330779.mp3
 The incorporated village of Westbury is in the town of North Hampstead.,common_voice_en_38050236.mp3
" Fifth Division, including One Panzer Division, were transferred from Arm Group, South Ukraine.",common_voice_en_38138188.mp3
" The Japanese release has two additional tracks, Black Light and Just Like Me.",common_voice_en_38235402.mp3
 during a six years residence in the eternal city bera won his greatest trumps,common_voice_en_38027733.mp3
 Kshetank Mountain is a wing-shaped mountain located in the Clinton Township.,common_voice_en_38039492.mp3
 Beckert's literary influence has been reflected in Greenaway's work.,common_voice_en_38178154.mp3
 Parts of the riverhead were placed under mandatory evacuation.,common_voice_en_38083457.mp3
 The airport is extremely important to the community which is not accessible by road.,common_voice_en_38083291.mp3
 He received the title of Honorary Doctor of the University of Healdersheim.,common_voice_en_38153850.mp3
" It is administered by Peter Moult of Moult and Associates of Auckland, New Zealand.",common_voice_en_38025720.mp3
 Sterile class is made up of artisans and merchants.,common_voice_en_38083442.mp3
 Finding the inverse of the Hissian in high dimensions can be an expensive operation.,common_voice_en_38059414.mp3
" Ardano's parents, Erre and Henry, were both heavily involved in the local racing circuit.",common_voice_en_38144094.mp3
" Well, we'll see if you mean what you say.",common_voice_en_38025125.mp3
 Women refrain from eating seeds of pomegranates at the festival.,common_voice_en_38272947.mp3
 The parabola has fourth holder contact with its oscillating circle there.,common_voice_en_38161404.mp3
 You want me to play it again? Yeah.,common_voice_en_38421201.mp3
 He blows the air out of the veranda of the house.,common_voice_en_38300243.mp3
" It was designed in the Italian art, architectural style.",common_voice_en_38354995.mp3
 안녕하세요.,common_voice_en_38424769.mp3
 The eating minerals may provide age information on a rock but assumptions must be made.,common_voice_en_38355724.mp3
 This is done by killing the old representative of the god.,common_voice_en_38304378.mp3
 The grave of Zeus was shown to visitors in Crete.,common_voice_en_38300120.mp3
 Thank you.,common_voice_en_38421016.mp3
 Kennedy's brother Robert and Carrington also served.,common_voice_en_38346836.mp3
 It is not hard to discern a conflict between two hostile forces or principles.,common_voice_en_38269744.mp3
 The line included a Jason Ellis signature model.,common_voice_en_38462930.mp3
 He and his siblings were raised Catholic.,common_voice_en_38398192.mp3
 Thank you.,common_voice_en_38451040.mp3
 Theoretical calculations using a quantum tunneling model support the experimental alpha decay half-lives.,common_voice_en_38127518.mp3
 The intimacy testaments of Jew rapid-loading and counter-temporary interruptions.,common_voice_en_38154522.mp3
 Meijer is een man die gebruikt wordt als een ademhoudsbankingboek.,common_voice_en_38153846.mp3
 Kjell Kronström,common_voice_en_38415013.mp3
" So too in other languages, such as French, German, Portuguese, and Spanish.",common_voice_en_38251595.mp3
 The death of Adonis is not the natural decay of vegetation.,common_voice_en_38300282.mp3
" Understanding about development, classification and localization of the disorder have greatly improved.",common_voice_en_38176542.mp3
 The landscape of southern Australia was always a source of inspiration for him.,common_voice_en_38145997.mp3
 Sebastian Vettel became the world's youngest stripper while dropping young.,common_voice_en_38084844.mp3
" They may mend articles made of seal skin, but they may not make anything new.",common_voice_en_38311210.mp3
" During his terms as Minister of Interior Affairs, he opened the Rabid University.",common_voice_en_38120074.mp3
 the party of summer came off victorious and the ceremony ended with a feast,common_voice_en_38280907.mp3
" In these books, a test list was given, the alias Spirosati.",common_voice_en_38326682.mp3
 The island is connected to the town of Mbereng with a pontoon bridge.,common_voice_en_38164350.mp3
 Dozens of Gliberphile editions honored his poems and prose sketches.,common_voice_en_38060733.mp3
" While stealing children, Lynch served as district attorney of Carmelite County.",common_voice_en_38099220.mp3
 Thank you.,common_voice_en_38439842.mp3
 ZZ pass has several related species living in temperate areas.,common_voice_en_38403274.mp3
 A Baron-Lectus is the lowest title of honour in the United Kingdom.,common_voice_en_38124603.mp3
" If you accept the nomination, I'll drop you like a hot potato, sir.",common_voice_en_38280722.mp3
" Even before being famous, Davis was paying head use.",common_voice_en_38394637.mp3
 They blacken his face and tile the goat on his back.,common_voice_en_38444711.mp3
 He married a minister's daughter with whom he had a daughter and son.,common_voice_en_38328917.mp3
" The present name is for Thomas Dana, a railroad official.",common_voice_en_38083292.mp3
" Kwa hivyo, kwa hivyo, kwa hivyo, kwa hivyo, kwa hivyo, kwa hivyo, kwa hivyo, kwa hivyo, kwa hivyo, kwa hivyo, kwa hivyo, kwa hivyo, kwa hivyo, kwa hivyo, kwa hivyo, kwa hivyo, kwa hivyo, kwa hivyo, kwa hivyo, kwa hivyo, kwa hivyo",common_voice_en_38033814.mp3
 Thank you.,common_voice_en_38449579.mp3
 We can continue to strengthen the education of good lawyers.,common_voice_en_38435317.mp3
 The park features a small museum that is open seasonally.,common_voice_en_38111525.mp3
 Peter has no formal qualifications in paleontology.,common_voice_en_38032505.mp3
 Various elements proposed are primary cost cutting measures proposed by the concessionary BomberArt.,common_voice_en_38471804.mp3
 Thank you.,common_voice_en_38421612.mp3
" This myth, it is almost needless to observe, does not really explain the custom.",common_voice_en_38265209.mp3
 Preterstern station is only used for suburban and regional train lines.,common_voice_en_38096112.mp3
 No person may cross a bridge while his superior in rank is passing underneath.,common_voice_en_38300123.mp3
 Why hair oils should be considered a vehicle of inspiration is not clear.,common_voice_en_38291809.mp3
 Bye.,common_voice_en_38390041.mp3
 One of the opponent's ball must be made in the other foot corner pocket.,common_voice_en_38047399.mp3
 The tunnel connects Bedford and Walton countries in South Central Penelope's Baniya.,common_voice_en_38032506.mp3
 The second part of the station's name was adopted from the nearby Trafod Abbey.,common_voice_en_38358823.mp3
 The dispute abruptly ended the comic strip adaptation of Thunderball.,common_voice_en_38039874.mp3
 We are now moved to the Lord.,common_voice_en_38424959.mp3
 The feeding of the serpents is represented on a Roman coin.,common_voice_en_38280871.mp3
" He was the presiding judge of the Superior Court of Orange County, California.",common_voice_en_38037480.mp3
 It opened under the leadership of Principal Vivian Tyler Samudio.,common_voice_en_38359686.mp3
 This made him the second William Russell Johnson,common_voice_en_38154737.mp3
 Film production was often commissioned and sponsored by business entities.,common_voice_en_38164620.mp3
" Reina Allah, Muhammadur Rasulullah",common_voice_en_38210247.mp3
 Thank you.,common_voice_en_38413850.mp3
 Woof!,common_voice_en_38420732.mp3
 The daughter goddess was a personification of the young corn of the present year.,common_voice_en_38312646.mp3
 The castle consists of the main castle with three separate outlying fortifications.,common_voice_en_38122312.mp3
 Merritt was married to Benjamin Hines and they had four children.,common_voice_en_38133234.mp3
 Okakura was a high-profile ebonite who had an international sense of self.,common_voice_en_38111849.mp3
 Cynthia and Sidney Tweed both withdrew from the race before balloting.,common_voice_en_38352510.mp3
 He ultimately entered into a restrained operation with Cindy.,common_voice_en_38099785.mp3
 Thank you.,common_voice_en_38419358.mp3
 Attached to the figure is an orange with feathers stuck into it.,common_voice_en_38300296.mp3
" Collaborators included Red Saunders, Joe Williams, Oscar Brown Jr. and little brother, Maud Gomery.",common_voice_en_38354439.mp3
 Congress cards come in an assortment of bag designs.,common_voice_en_38398622.mp3
 People attribute cholera to a goddess who visits the affected family.,common_voice_en_38278462.mp3
 Thank you.,common_voice_en_38419206.mp3
 It is affiliated modularly by Singtao Chinese Radio in Cantonese.,common_voice_en_38153663.mp3
 Cladis take relationship among geckoni lizards.,common_voice_en_38153703.mp3
" Hoju started playing with Lord Scott, Sidney Pichard, Lucky Roberts and Sheik Webb.",common_voice_en_38361696.mp3
 A behavior called rep-irrhenation is central to this mechanism.,common_voice_en_38156040.mp3
 The first six verses addresses the legal status of Zihar as petitioned by Kauula.,common_voice_en_38083443.mp3
 The town was named for German Prince Karl Wilhelm Ferdinand of Brunswick-Lonenburg.,common_voice_en_38430247.mp3
 I think we all vote for a tie.,common_voice_en_38419749.mp3
" Hex Honolulu entered the Nuclear Powered Ships and Submarine Recycling Program in Bremerton, Washington.",common_voice_en_38033380.mp3
 The church and schoolhouse have since been preserved as museums.,common_voice_en_38029253.mp3
" Intentional relationships are means, ends, decompositions, contributions, colorations and independency.",common_voice_en_38026404.mp3
 Epilepsy can be cured by striking the patient in the face.,common_voice_en_38281206.mp3
" During those hard times, Torgler managed to keep himself in a well-paid position.",common_voice_en_38382281.mp3
" The resulting by-elections were often formalities, as many ministers were unopposed following their appointments.",common_voice_en_38089594.mp3
" Lie bulbs, jokes, applied to subgroups can be used to ease tension between them.",common_voice_en_38165305.mp3
 Distrăgă-te în flori.,common_voice_en_38316580.mp3
" In addition, he recorded with longtime friend Tom Peterson's chip trick persist.",common_voice_en_38059400.mp3
" He had great success playing in Europe, most notably for Olympia and Aries.",common_voice_en_38116075.mp3
 This gonna works as a deterministic affinity automaton.,common_voice_en_38328268.mp3
 Go to the transcripts and you can see the equipment on both pages.,common_voice_en_38302047.mp3
 Thank you.,common_voice_en_38448908.mp3
 Metro Parkway is an expressway between the Shoheil Road and its east door terminus.,common_voice_en_38133154.mp3
 Hi.,common_voice_en_38424386.mp3
 Thanks for watching!,common_voice_en_38473793.mp3
 His right to the throne terminated and passed to his daughter's husband.,common_voice_en_38278517.mp3
" This snowman dance was performed in Concord, Erie towns.",common_voice_en_38116470.mp3
 Edwin H. Lanz Essays,common_voice_en_38390294.mp3
" An idiot admires complexity, a genius admires simplicity.",common_voice_en_38316390.mp3
 Strings were formed by the Necheville string machine.,common_voice_en_38029124.mp3
 It was produced by Adrian Beliu.,common_voice_en_38034413.mp3
 sylvan headland changed to carella almost exactly after the estate opened,common_voice_en_38251754.mp3
 The first captured men were held at Pochazet village.,common_voice_en_38400435.mp3
 This international event welcomes musical lovers from all over the world to Beipu.,common_voice_en_38099746.mp3
" The site, like many in the capital Rome, is challenged for external perspectives.",common_voice_en_38056487.mp3
 People believe that their origin is from Chota Nagpur Plateau.,common_voice_en_38233271.mp3
" Then, the casualty is flattened against the chests, and the first responders stand up.",common_voice_en_38057410.mp3
 It is one of the most popular feasts of the year.,common_voice_en_38255109.mp3
 Insider information may be thought of as more accurate and valuable than expert opinion.,common_voice_en_38031569.mp3
" This story was adapted to a film by Jeremy Peter Allen, Menace of Dying.",common_voice_en_38099180.mp3
 La ilaha illallah Muhammadurrasulullah,common_voice_en_38210245.mp3
 The Grizzly Bear Dance was featured on Broadway in vaudeville at the Cabaret Performances.,common_voice_en_38070332.mp3
 Over the following two weeks she has suffered from complications of the heart and kidneys.,common_voice_en_38161363.mp3
 The Bluegrass Band through Greenbrier Boys provided backup on,common_voice_en_38154654.mp3
" He was raised in Cleveland, but later moved to Shekai's Oahu.",common_voice_en_38081647.mp3
 Siri Dwenne cheesed him.,common_voice_en_38111647.mp3
 The contraption quickly lifted off its stand and collided with the civil.,common_voice_en_38328308.mp3
" As the market became increasingly competitive, the need for regulation decreased.",common_voice_en_38471344.mp3
 Fletcher also rented out the building as a hall for local social events.,common_voice_en_38222626.mp3
" Unlike its near neighbors, the village is not mentioned in their Domesday Book.",common_voice_en_38084529.mp3
 Thank you.,common_voice_en_38415359.mp3
 The Magali Air is heard in the Pulsang et Edus.,common_voice_en_38060732.mp3
 Why put a man-god or human representative of deity to a violent death?,common_voice_en_38311199.mp3
 No way.,common_voice_en_38390055.mp3
 is the main base in Orlando Sanford International Airport.,common_voice_en_38400796.mp3
 they will be more likely to give them masculine than feminine freshness.,common_voice_en_38284633.mp3
 Reusing current materials uses even less energy than recycling.,common_voice_en_38062657.mp3
ご視聴ありがとうございました,common_voice_en_38029092.mp3
 The film won the Audience Award at the Carle V. Barry International Film Festival.,common_voice_en_38132075.mp3
" The participating countries were Chile, Ecuador, Paraguay, Peru, and Uruguay.",common_voice_en_38083330.mp3
" During the battle, Murad's base was seriously injured.",common_voice_en_38116115.mp3
 Free was known as the prince of Nala's own world.,common_voice_en_38033802.mp3
 City will be the first team to professional to play in Brazil.,common_voice_en_38079100.mp3
" Naval Observatory, Washington.",common_voice_en_38028945.mp3
 No merit awards or athletic scholarships are offered by Pomona.,common_voice_en_38114662.mp3
" During his administration, Anne was the assistant of Ramon Srosa, Soto launched Liberal Reform.",common_voice_en_38033803.mp3
 Thank you.,common_voice_en_38448920.mp3
" They are normally sold as a sodium salt, therefore they are in solution and ionic.",common_voice_en_38324446.mp3
 Fuzz Connor to put the negotiation down to a two-way handshake.,common_voice_en_38321714.mp3
 Centralizers are subgroups. This again shows that the center is a subgroup.,common_voice_en_38365591.mp3
 Alan Brown John was born in London and educated at Merton College.,common_voice_en_38154736.mp3
 Your assignment is due on Monday morning. Don't be late.,common_voice_en_38265426.mp3
