en_text,file_names
 Art Arya studied art and fashion design in Bangkok and France.,common_voice_en_38209503.mp3
 During overnights it has paid programming from jewelry television.,common_voice_en_38164387.mp3
 Thank you.,common_voice_en_38471436.mp3
 The video some men see Florine and I hear they perform the song in a bowling alley.,common_voice_en_38079060.mp3
 you,common_voice_en_38449381.mp3
" Historians find little trace of Jane, Chaco's rusell influence in Africa.",common_voice_en_38099829.mp3
" The movie was filmed entirely in Kalamazoo, Michigan.",common_voice_en_38381763.mp3
 They must bathe by day and night before going out to the chase.,common_voice_en_38276936.mp3
 The green vegetable usually represents the possibility of new growth.,common_voice_en_38300134.mp3
 Alex Figgerson said Berkstrasse Performance School have been set to music.,common_voice_en_38078948.mp3
" For the British Monarchs, see List of British Monarchs.",common_voice_en_38174008.mp3
 The projector had a number of defeat.,common_voice_en_38025093.mp3
" In fact, many municipalities are negatively affected by this system.",common_voice_en_38080822.mp3
 Taking all of them together yields the compound of two snub cubes.,common_voice_en_38116505.mp3
 Everyone should have something like it at least once in their lives.,common_voice_en_38170681.mp3
 Thank you.,common_voice_en_38079467.mp3
" Rock and roll, however, has a greater emphasis on the backbeat than boogie woogie.",common_voice_en_38229374.mp3
" Other significant tributaries include Houghton, Stover, Porter and Leopkrigs.",common_voice_en_38100204.mp3
 The Bishop of Washington says that its Chief Executive Officer,common_voice_en_38122266.mp3
 A little girl is carried to the spot on a man's shoulder.,common_voice_en_38267153.mp3
 The globe ident also saw the introduction to widescreen IDNets.,common_voice_en_38229771.mp3
" He received the second highest vote total, behind Ty Cobb and tied with Babe Ruth.",common_voice_en_38240882.mp3
 Seattle's then went to lose the final it happened to Irvine Meadow,common_voice_en_38115970.mp3
 One writer to identify the Sadducees as the target was Johann Nepomuk Sepp.,common_voice_en_38133544.mp3
" After death, the prohibitions are not only maintained, but extended.",common_voice_en_38267150.mp3
 Thank you.,common_voice_en_38420849.mp3
 Georgia has terminated its diplomatic relations with Russia and Nicaragua.,common_voice_en_38361697.mp3
 The genus is endemic to southern Argentina.,common_voice_en_38382486.mp3
 Its uneven bottom slopes throughout its whole length from north to south.,common_voice_en_38311207.mp3
" Naturally, modern ciphers are not restricted to uppercase, no punctuation, G-less message.",common_voice_en_38153111.mp3
" That's not a take, but I stand by it anyways.",common_voice_en_38267351.mp3
 It is from this connection that the term ballad opera is drawn.,common_voice_en_38180361.mp3
 The mountain is basically a column of trichet.,common_voice_en_38334656.mp3
 The episodes are edited by Hewlett himself.,common_voice_en_38389712.mp3
 Edgy runs a webpage titled Of Arms in the Law.,common_voice_en_38032472.mp3
 The Seafo Parish contains two wards.,common_voice_en_38050237.mp3
 It became necessary to rekindle the royal fire by the friction of wood.,common_voice_en_38083440.mp3
" According to their choice, they were bound to provide him with victuals.",common_voice_en_38311173.mp3
 There is now a new roller receiver finish that looks like Damascus steel.,common_voice_en_38208543.mp3
 Pillars are of the Ndravidion order.,common_voice_en_38176608.mp3
" And I went and said, I wonder where the shutter of the truck is located.",common_voice_en_38354203.mp3
" In contrast, mummification appears to have been practiced by a large part of the population.",common_voice_en_38358411.mp3
 Thank you.,common_voice_en_38450969.mp3
 Rama is also an adjunct professor at Duke Cancer Institute.,common_voice_en_38047372.mp3
 Nagamoto has a brother Vishal who plays cricket for Guyana.,common_voice_en_38161376.mp3
 Two songs were co-written with Marisa Monte and Arnaldo Antunes.,common_voice_en_38068387.mp3
" He was served by his wife, three daughters, and a brother.",common_voice_en_38035518.mp3
 Ado General and Administrator.,common_voice_en_38164151.mp3
" Kwa hivyo, kwa kwa, kwa kwa, kwa kwa, kwa kwa, kwa kwa, kwa kwa, kwa kwa, kwa kwa, kwa kwa, kwa kwa, kwa kwa, kwa kwa, kwa kwa, kwa kwa, kwa kwa, kwa kwa, kwa kwa, kwa kwa, kwa kwa, kwa kwa, kwa kwa, kwa kwa, kwa kwa, kwa kwa",common_voice_en_38377237.mp3
 Thank you.,common_voice_en_38449155.mp3
" He later enrolled in the Omare Prefectural Normal School, today part of Rosargi University.",common_voice_en_38059358.mp3
 Her co-workers regard her as responsible and dependable and not her non-nonsense attitude.,common_voice_en_38116262.mp3
 Some of these papers included correspondence from Peter Marshall Photographs and Recordings.,common_voice_en_38365545.mp3
 Forbes began her colligate career at Coastal Carolina.,common_voice_en_38146078.mp3
 The initial cars were locally assembled versions of contemporary American and British Ford models.,common_voice_en_38098880.mp3
 Rea era o splintvici în trei distriți.,common_voice_en_38354228.mp3
 Maximum Entropy has also been applied successfully for summarisation in the broadcast news domain.,common_voice_en_38352712.mp3
 Mark Holland and Anne Murguia were on the ballot in the general election.,common_voice_en_38084847.mp3
 The modern names name dates from the end of the independent war.,common_voice_en_38080217.mp3
 poepleport appears to have had a long insidious relationship with his daughter adelaide,common_voice_en_38027445.mp3
 working on the new skins of caribou is strictly prohibited,common_voice_en_38311159.mp3
 Milton must have been familiar with the custom of the harvest queen.,common_voice_en_38315513.mp3
 The Rishabh Bartram Association Society is based in the village.,common_voice_en_38147945.mp3
 He had worked on the enormous task intermittently for many years.,common_voice_en_38237638.mp3
 South Point is served by the Brownsville Independent School District.,common_voice_en_38248400.mp3
 The centre was raised during the Pataviyam revolt.,common_voice_en_38330988.mp3
 Helo,common_voice_en_38356760.mp3
 Any boat in clear air to windward has an aerodynamic advantage over other boats.,common_voice_en_38413139.mp3
" However, Capone never went to trial on these charges.",common_voice_en_38329638.mp3
 Green Summer was the subject of a documentary titled Devon Green The Journey.,common_voice_en_38191859.mp3
" There, together with performance artist Nils Dumas, he set up a weekly coverage.",common_voice_en_38355719.mp3
 The training initiative focuses on providing parenting and job training classes.,common_voice_en_38100173.mp3
 തതതതതതതതതതതതതതതതതതതതതതതതതതതതതതതതതതതതതതതതതതതതതതതതതതതതതതതതതതതതതത,common_voice_en_38346572.mp3
 You can also access the e-commerce by providing information and secure services.,common_voice_en_38332184.mp3
 De so pulver da bayzin o Flish Dog Park is e Dog Park in Essino.,common_voice_en_38377022.mp3
 This is also known as systolic computation.,common_voice_en_38081243.mp3
 Mitchell was persuaded to join the management committee.,common_voice_en_38057374.mp3
 and the best.,common_voice_en_38188264.mp3
" Kwa hivyo, hivyo hivyo hivyo hivyo hivyo hivyo hivyo hivyo hivyo hivyo hivyo hivyo hivyo hivyo hivyo hivyo hivyo hivyo hivyo hivyo hivyo hivyo hivyo hivyo hivyo hivyo hivyo hivyo hivyo hivyo hivyo hivyo hivyo hivyo hivyo hivyo hivyo hivyo hivyo hiv",common_voice_en_38328041.mp3
 The exterior is considered unusual in singular treatment of the belfry.,common_voice_en_38078989.mp3
 Thus Rupert and Robert are different modern forms of the same name.,common_voice_en_38142394.mp3
 There is an indefinite number of spirits of each class.,common_voice_en_38300108.mp3
 I hate no girls.,common_voice_en_38211365.mp3
 He has written a small manifesto explaining why he did this.,common_voice_en_38142397.mp3
 Thank you.,common_voice_en_38450822.mp3
 Probably due to calmness intervention no further action was taken.,common_voice_en_38398179.mp3
 They are currently concerted to the daily legend of Russian rock music.,common_voice_en_38347123.mp3
 She hung the hair on a peg and fumigated it with brimstone.,common_voice_en_38265425.mp3
 Lens accepts the configuration options from either command Lens options or configuration place.,common_voice_en_38079513.mp3
 The jingle has been procreated by Mr. Gordon.,common_voice_en_38354413.mp3
" After two months training with Michaelsfield Town, Larmore returned to Northern Highland and Linfield.",common_voice_en_38033591.mp3
" OK, I'll take your word for it.",common_voice_en_38293760.mp3
 think which is of Crote origin,common_voice_en_38371337.mp3
 It was shot at the Sievering Studios in Vienna.,common_voice_en_38070694.mp3
 Thank you.,common_voice_en_38414906.mp3
 The boys take this effigy to the nearest brook or pool.,common_voice_en_38315512.mp3
 and billions on the island of Florida.,common_voice_en_38170682.mp3
 The two men formed a company to make the film Benhar.,common_voice_en_38318753.mp3
 You chose Tori and...,common_voice_en_38419826.mp3
 His question is of use to Tara Payne.,common_voice_en_38356238.mp3
 Thank you.,common_voice_en_38324690.mp3
 The guidance was designed by the Corporation Survey for Samar Shihongwa Day.,common_voice_en_38062872.mp3
 Rushing motion may be continuous or confined to less than one evolution.,common_voice_en_38358969.mp3
 Thank you.,common_voice_en_38419403.mp3
 He laid her out. It was a mean thing to do.,common_voice_en_38403260.mp3
" Hello, how are you? My name is John.",common_voice_en_38310864.mp3
 Thank you.,common_voice_en_38358983.mp3
 Tourism based on the natural and historical resources of the area remains underdeveloped.,common_voice_en_38098909.mp3
 Cray saves Amanda Waller from a group of assassins.,common_voice_en_38235164.mp3
 The Kuzee-Dikawoe-Hantaka-Thas Ndea language is a part of the Shoshone language.,common_voice_en_38359877.mp3
 The argument would apply equally to all the infants.,common_voice_en_38297262.mp3
 The oats goat is sitting in the oats field.,common_voice_en_38444868.mp3
 The rune is identical in shape to the letter I in the Reytik alphabet.,common_voice_en_38237611.mp3
 An outraged Morin stand up and scream that the Colonel is a liar.,common_voice_en_38033632.mp3
 The data is fed into the integrated undersea surveillance system.,common_voice_en_38180349.mp3
 Most general like a hypothesis for monophilia.,common_voice_en_38091871.mp3
 A local resident of the group begins to interact with her.,common_voice_en_38350850.mp3
 The upper courses of the route and Kinnikinnik rivers flow through the city.,common_voice_en_38159575.mp3
 It means that pre-sharing applicable to all exams or excluded transactions.,common_voice_en_38081877.mp3
 Valencia started working as a caricature artist early and never went to a school.,common_voice_en_38080598.mp3
 Moff Guillaume has been received positively by both reviewers and fans.,common_voice_en_38422737.mp3
 Flanagan claims that he was jumped and the stabbing was in self-defense.,common_voice_en_38381760.mp3
 Regrind picii vechi dintre înhațările din original.,common_voice_en_38177313.mp3
" In Eastern Ontario speech, the tongue give is often abbreviated again.",common_voice_en_38126163.mp3
 Thank you.,common_voice_en_38460923.mp3
 Curtis was once part of Tandek.,common_voice_en_38358002.mp3
 Sean Morgan uses Gekta Gitas with whom he has a signature model.,common_voice_en_38394743.mp3
" Kwa hivyo, kwa hivyo, kwa hivyo, kwa hivyo, kwa hivyo, kwa hivyo, kwa hivyo, kwa hivyo, kwa hivyo, kwa hivyo, kwa hivyo, kwa hivyo, kwa hivyo, kwa hivyo, kwa hivyo, kwa hivyo, kwa hivyo, kwa hivyo, kwa hivyo, kwa hivyo, kwa hivyo",common_voice_en_38057148.mp3
 Thank you.,common_voice_en_38415010.mp3
" In youth, he joined the Carmelite order, becoming a friar at Blakeney near Watsingham.",common_voice_en_38396340.mp3
 Koyushimu is described as being of gentle lineage.,common_voice_en_38249133.mp3
 Thank you.,common_voice_en_38448512.mp3
 She has published extensively in India and abroad.,common_voice_en_38211370.mp3
" Emma Lysias, Spammer called to use this tactic to send large numbers of messages anonymously.",common_voice_en_38040025.mp3
 Professor Bourguin is captured and friends Heigou in Haiti.,common_voice_en_38377592.mp3
" As a demand for his service declined, he accepted a wider variety of job offers.",common_voice_en_38132880.mp3
 Leisure centers Canada are staffed by leisure center attendants employed by the local council.,common_voice_en_38395886.mp3
 It is located in the tegmentum of the midbrain next to the subterranean nigra.,common_voice_en_38116473.mp3
 The creation of reverse tight rag key has been attributed to the North Storm Retail,common_voice_en_38361641.mp3
 The old men get twice as large a portion of food as the others.,common_voice_en_38286780.mp3
 The university's campus is located in what was previously Saddam Hussein's Al-Qa'o Palace.,common_voice_en_38029469.mp3
 He is currently developing a martial art epic for your film cast master.,common_voice_en_38157161.mp3
" Therefore, the difficulty of the game is based primarily on improving one's own skills.",common_voice_en_38089557.mp3
" Throughout time, the frequency of the U-shaped structures increases and the distribution changes.",common_voice_en_38164796.mp3
 Thank you.,common_voice_en_38448261.mp3
 A Remixed and Remastered Edition of Sluggoo,common_voice_en_38199426.mp3
" Obviously, I didn't want to use real names yet.",common_voice_en_38343408.mp3
 Those rarely present themselves under their respective primary forms.,common_voice_en_38033790.mp3
 She defeated Republican nominee Steve Plaguehart in the general election.,common_voice_en_38153702.mp3
 Thank you.,common_voice_en_38421028.mp3
 There stood of old a bronze image of a goat.,common_voice_en_38267146.mp3
 Double. Beautiful Joe. Double trouble.,common_voice_en_38395064.mp3
 It was Harmonia and not Europa whose wanderings were dramatically represented.,common_voice_en_38300137.mp3
 Bauer also debunked what Ralph Reichow has termed the timeless approach to history.,common_voice_en_38249286.mp3
 The terrorist falls away and cliffs 300 feet high.,common_voice_en_38318745.mp3
" I got something strong around me, hey!",common_voice_en_38390096.mp3
 We establish mobile field hospitals to be located at Division and Curbs headquarters.,common_voice_en_38115971.mp3
 Its international secretary is in Brussels.,common_voice_en_38155978.mp3
 Thank you.,common_voice_en_38450564.mp3
 Closer it took her rather than enjoy this city all in exile for the next two years.,common_voice_en_38347069.mp3
 Thank you.,common_voice_en_38177307.mp3
 Mellon was Presbyterian by faith.,common_voice_en_38337639.mp3
 One face is built in gothic style while the other is of classical design.,common_voice_en_38127478.mp3
" During this time she may have been renamed Memphis, but the details are unclear.",common_voice_en_38249131.mp3
 The men stick the poles of their scythes in the ground.,common_voice_en_38318381.mp3
 Pellegrino appeared on Good Morning America to promote his book.,common_voice_en_38207512.mp3
" Jordan and his wife Carissa have two children, son Jackson and daughter Skylar.",common_voice_en_38403882.mp3
 The national exhibition is the All Japan Chrysanthemum Federation National Convention.,common_voice_en_38133988.mp3
 Publicity is generally reliable when compared with major African cities.,common_voice_en_38033800.mp3
" Annie was born in Columbus, Ohio.",common_voice_en_38139860.mp3
 Thank you.,common_voice_en_38461157.mp3
 The Bickel hops grouped three plantings by genus.,common_voice_en_38221878.mp3
 He is the younger brother of Arena Football League player and coach Laurence Samuels.,common_voice_en_38358413.mp3
" His two lead singers were Pop Star and Human, the latter Divinil Scoville.",common_voice_en_38165138.mp3
 The location is on the route to mountain passes to the Aizu region.,common_voice_en_38207511.mp3
 It results in uterovaginal outflow tract obstruction.,common_voice_en_38220179.mp3
 Every Tamil temple of note has its troupe of these sacred women.,common_voice_en_38304608.mp3
 A monument to the Red Army is situated near the train station.,common_voice_en_38113457.mp3
 French Creek empties into the Ohio and its coastal end.,common_voice_en_38471557.mp3
 Thank you.,common_voice_en_38419819.mp3
" After touching a pig, a man had to wash himself and his clothes.",common_voice_en_38265380.mp3
 The heart of the sea is not peculiar to games.,common_voice_en_38029130.mp3
 Thank you.,common_voice_en_38461023.mp3
 Arithmetic is then derivable in second order logic from Hume's principle.,common_voice_en_38041701.mp3
 He was unable to play any tournaments after July due to a shoulder injury.,common_voice_en_38352855.mp3
 He joined the Indian National Congress and actively participated in the Indian Freedom Movement.,common_voice_en_38032510.mp3
 Emily calls Katherine for help.,common_voice_en_38398233.mp3
" All are strongly influenced by his family history, childhood and individuality.",common_voice_en_38356428.mp3
 Navara and Simone wind up in bed together but he is unable to perform.,common_voice_en_38343351.mp3
 Thank you.,common_voice_en_38421029.mp3
 Kramer refers to Shoji as the first long-distance running champion.,common_voice_en_38195427.mp3
 Thank you.,common_voice_en_38390068.mp3
" Despite not being properly released, the album got positive reviews.",common_voice_en_38052568.mp3
" Bang, bang.",common_voice_en_38390134.mp3
 The Long Island Lutheran Middle and High School is also located in the village.,common_voice_en_38127525.mp3
 Common forms of this include range predictors and memory dependence prediction.,common_voice_en_38032470.mp3
 His public works were admired by Governor McCrary.,common_voice_en_38153500.mp3
 Early medieval manuscripts were produced in monastic scriptoria by scribes and artists.,common_voice_en_38390336.mp3
 Most citizens had the prudence to dwell dispersed on their farms.,common_voice_en_38265988.mp3
 He was born in Oslo as a son of Gustav Severin Henriksen.,common_voice_en_38365633.mp3
 Most physical Muslims now have an online presence with varying degree of online information.,common_voice_en_38396632.mp3
" Tuas verid in Colmar, California.",common_voice_en_38313836.mp3
 Keeney is a product of POTS mouth use scheme.,common_voice_en_38099354.mp3
 The Seminole tribe of Florida requested that the state enter into such a negotiation.,common_voice_en_38081083.mp3
 It works with numerous first-night licensed events throughout the United States.,common_voice_en_38029290.mp3
" The rules may create social problems in some situations, especially for the widow.",common_voice_en_38251594.mp3
" which is a large royal point of hope, named after Franzen.",common_voice_en_38155833.mp3
 Thank you.,common_voice_en_38449035.mp3
 It was by contact party since that Ellen kisses William his forces.,common_voice_en_38081848.mp3
 He also helped to retrieve bodies of deceased Georgiana soldiers and civilians.,common_voice_en_38313957.mp3
 It turns from dark green to dark brown when fully mature.,common_voice_en_38025253.mp3
" I second book, Salvo Nuri, adres de effecto salvia divinorum.",common_voice_en_38079923.mp3
" The duke was a member of the Wittelbech family, former rulers of Bavaria.",common_voice_en_38029252.mp3
 John had sent for his stenographer.,common_voice_en_38158904.mp3
我沒有講床面的,common_voice_en_38417217.mp3
 The king's reign was cut down from 8 years to 4 years.,common_voice_en_38293562.mp3
 For more information see Götterall.org,common_voice_en_38026820.mp3
 It could be characterized as slightly more rural than suburban.,common_voice_en_38400768.mp3
 It is known for improvising electronic sounds that feature,common_voice_en_38165919.mp3
 The figure of the carnival is made to tumble into it.,common_voice_en_38297263.mp3
 Women take bamboo splints and fashion little models of virus-useful articles.,common_voice_en_38330355.mp3
 You will see a little pile of earth adorned with flowers.,common_voice_en_38255095.mp3
" After his guilty plea, Muriel tried repeatedly to withdraw",common_voice_en_38125132.mp3
 Park Creek's many years northward drew the community of the Heaven at Warm Springs Court.,common_voice_en_38366925.mp3
 Hugh then frees his father and sucks Nathan with Dracula's punishment.,common_voice_en_38047159.mp3
 Camphoric acid may be prepared by oxidizing camphor with nitric acid.,common_voice_en_38395926.mp3
 The persons of the house are supposed to be affected with an evil destiny.,common_voice_en_38265382.mp3
 Ugly beauty is the only words among Thelonious monks recorded compositions.,common_voice_en_38125085.mp3
 The trap is affixed by a heavy chain to an immobile object.,common_voice_en_38330396.mp3
 They slew the animal in retaliation for the loss of a king's man.,common_voice_en_38265342.mp3
 The wood also yields a red dye called braziline which oxidizes to brazilane.,common_voice_en_38084516.mp3
 Two injuries and around $1 million in damage reported.,common_voice_en_38166235.mp3
 Vic and Billy Corgan working together as co-producers.,common_voice_en_38176596.mp3
 Neutrinos thus developed a reputation as being undetectable.,common_voice_en_38130529.mp3
 I save only the one who will protect me in the end.,common_voice_en_38343026.mp3
 Bell recorded two albums with the band before getting into the punk scene.,common_voice_en_38215738.mp3
 I've been in this marriage twice.,common_voice_en_38347121.mp3
 He is the brother of the prolific film composer Christoph Beck.,common_voice_en_38164768.mp3
 The pectoral is the latest addition to Epsi's Skopal Ornament.,common_voice_en_38357330.mp3
 Rosemary Beach is developed on land originally part of the older Inlet Beach neighborhood.,common_voice_en_38033579.mp3
 Both numbers in these sections are hexadecimal and all ranges are inclusive.,common_voice_en_38080943.mp3
" De teia, lox bilanctu di centrum nun est de collocae.",common_voice_en_38328296.mp3
" After his second term, he was succeeded by Democrat Henry Traff again.",common_voice_en_38081876.mp3
" Tuketl lakes, Chinango lake and Lili lake are found within the park.",common_voice_en_38057767.mp3
 The notion seems to be that the ceremony promotes fertility.,common_voice_en_38285841.mp3
 Iron Man defeats the Mandarin once again and helps Stark's employees escape the Hand.,common_voice_en_38198328.mp3
 John Graves Simcoe,common_voice_en_38027645.mp3
 The Drawer table shows how many spell slots you have.,common_voice_en_38300241.mp3
" Therefore, the Imo-Auka festival was initiated to commensurate the worship.",common_voice_en_38348364.mp3
 Thank you.,common_voice_en_38449194.mp3
" Hamilton ruled, wore both backstage and in the ring under his flame ring persona.",common_voice_en_38153660.mp3
" Also offered are choruses including jazz, choir, show choir and a Roman chorus.",common_voice_en_38153112.mp3
 From the losing players secret vote.,common_voice_en_38419211.mp3
 Non-credit continuing education classes are also available in a wide variety of areas.,common_voice_en_38233258.mp3
 This home is on the National Historical Landmark Registry.,common_voice_en_38201174.mp3
 This society was primarily anatomical with some geology and very little botany.,common_voice_en_38163617.mp3
 Thank you.,common_voice_en_38390057.mp3
 The kings of the first dynasty build a temple to the hawk,common_voice_en_38317463.mp3
" Indica Sanctuary Ningguan, Maine",common_voice_en_38357287.mp3
 Album-tourney through several emotions with ear-ear tones and metaphorical lyrics.,common_voice_en_38319277.mp3
 The company also opened its own online shopping marketplace in the same month.,common_voice_en_38098881.mp3
 Kaleo mentioned that the financial crisis showed the value of personal relationships,common_voice_en_38376868.mp3
 He is supported by a wooden frame with a gilt canopy.,common_voice_en_38280720.mp3
 Actors may then challenge and disobey some rules because they add to other rules.,common_voice_en_38125873.mp3
 capote and crash received the second highest number with three each,common_voice_en_38384949.mp3
 Karens were attached to the convent in order that mass night might be saved.,common_voice_en_38360039.mp3
" Berwickshire District Council reminded based in Duns, the old county town.",common_voice_en_38035486.mp3
 God and us born in plain field connected.,common_voice_en_38352664.mp3
 He needs someone to throw earth on his body after his death.,common_voice_en_38080610.mp3
 Astronomers observe the sky for X-rays emitted by infalling matter to detect black holes.,common_voice_en_38220390.mp3
" The formulations listed, unless otherwise indicated, are generally oil solutions for intramuscular injection.",common_voice_en_38251581.mp3
 Отлично!,common_voice_en_38462890.mp3
 The disease affected Charles' leg and eventually left him completely disabled.,common_voice_en_38040033.mp3
 The station was supplied from Mirnyi Station on the Antarctic coast.,common_voice_en_38220543.mp3
 A lifeguard is placed under the last bundle of corn.,common_voice_en_38275027.mp3
" Today, the building is occupied by the Barcelona Perfume Museum.",common_voice_en_38382478.mp3
" For his machine, Riley placed a modified doorbell assembly in a brass box.",common_voice_en_38074976.mp3
 The movie was released after her death and was dedicated to Susie's memory.,common_voice_en_38240880.mp3
 Thank you.,common_voice_en_38439667.mp3
 The person who binds the last sheaf is wrapped in ears of oats.,common_voice_en_38291798.mp3
" Killings was born in Atlanta, Georgia, but raised in Charlotte, North Carolina.",common_voice_en_38063005.mp3
